Chapter	Text_no	Hymn
1	1	S’ri Nârâyana said :-- This (Highest) Prakriti is recognised as five-fold. When She is engaged in the work of Creation, She appears as :--  Durgâ, the Mother of Ganes’a,   Râdhâ,  Laksmî,  Sarasvatî and  Sâvitrî.
1	2-3	Nârada replied :-- O Thou, the best of Jñânins! Who is this Prakriti? (Whether She is of the nature of Intelligence or of matter?) Why did She manifest Herself and then again why did She reveal Herself in these five forms? And what are Her characteristics? Now Thou oughtest to describe the lives of all, the different modes of their worship, and the fruits that are accrued thereby. Please also inform me which Forms of them manifested themselves in which different places. Dost Thou please narrate to me all these.
1	4-18	Nârâyana said :-- “O Child! Who is there in this world that can describe fully the characteristics of Prakriti! However I will describe to you that much which I heard from my own father, Dharma. Hear. The prefix “Pra” in the word Prakriti means exalted, superior, excellent; and the affix “Kriti” denotes creation. So the Goddess, the Devî Who is the most excellent in the work of creation is known as the Devî Prakriti. To come closer :-- “Pra” signifies the Sattva Guna, the most exalted quality, “Kri” denotes the Rajo Guna and “Ti” denotes the Tamo Guna. (The Sattva Guna is considered as the Highest as it is perfectly clear and free from any impurities whatsoever; the Rajo Guna is considered intermediate as it has this defect :-- that it spreads a veil over the reality of things, so as not to allow men to understand the True Reality, while the Tamo Guna is considered worst as it completely hides the Real Knowledge).So when this Intelligence of the nature of Brahmâ, beyond the three attributes, gets tinged with the above three Gunas and becomes omnipotent, then She is superior (Pradhânâ) in the work of creation. Hence She is styled as Prakriti.O Child Nârada! The state just preceding that of creation is denoted by “Pra”; and “Kri” signifies creation. So the Great Devî that exists before creation is called Prakriti after creation. The Paramâtmâ by His Yoga (i.e., Mâyâ S’akti, the Holy Ghost) divided Himself into two parts; the right side of which was male and the left side was the female Prakriti. (Note :-- The Holy Ghost is the principle of Conception and Emanation, Creation). So the Prakriti is of the nature of Brahmâ. She is eternal. As the fire and its burning power are not different, so there is no separate distinction between Âtman and His S’akti, between Purusa and Prakriti. Therefore those that are foremost and the highest of the Yogis do not recognise any difference between a male and a female. All is Brâhman. He is everywhere as male and female forever. There is nothing in this world that can exist for a moment even without this Brâhman consisting of male and female. (i.e. they are Brâhman with Mâyâ manifested). Out of the Will of S’rî Krisna, to create the world Whose Will is all in all, came out at once the Mûlâ Prakriti, the Great Devî Îs’varî, (the Lady Controller of the Universe) Brahmâ with Mâyâ in a state of equilibrium). By Her command came out five Forms of Her, either for the purpose of creation or for bestowing Favour and Grace to the Bhaktas (devotees). Durgâ the Mother of Ganes’a, comes, as the first, the most auspicious, loved by S’iva. She is Nârâyanî, Visnu Mâyâ, and of the nature of Pûrna Brahmâ (the Supreme Brahmâ). This eternal, all auspicious Devî is the Presiding Deity of all the Devas and is, therefore, worshipped and praised by Brahmâ and the other Devas, Munis, and Manus. This Bhagavatî Durgâ Devî, (when She gets pleased) destroys all the sorrows, pains and troubles of the Bhaktas that have taken Her refuge, and gives them Dharma, everlasting name and fame, all auspicious things and bliss and all the happiness, nay, the Final Liberation! She is the Greatest Refugeof these Bhaktas that come to Her wholly for protection and are in great distress, whom She saves from all their dangers and calamities. In fact, know this Durgâ Devî as, verily, the Presiding Deity of the heart of Krisna and as His Highest S’akti, of the nature of the Holy Fire and the Holy Light. She is Omnipotent and resides always with Krisna, the Great God. She is worshipped by all the Siddha Purusas (those that have attained success); the (eighteen) Siddhis all go to Her and when pleased She gives whatever Siddhis (success) that Her Bhaktas want.
1	19-40	This Great Devî is the intelligence, sleep, hunger, thirst, shadow, drowsiness, fatigue, kindness, memory, caste, forbearance, errors, peace, beauty, and consciousness, contentment, nourishment, prosperity, and fortitude. She is sung in the Vedas and in other S’âstrasas the Mahâ Mâyâ, of the nature of the Universe. In reality, She is the All-S’akti of the Universe and She is the S’akti of Krisna. All these qualities are also mentioned in the Vedas. What is mentioned here is a tithe merely, in comparison to that of the Vedas. She has infinite qualities. Now hear of other S’aktis. The second S’akti of the Paramâtman is named Padmâ (Laksmî). She is of the nature of S’uddha Sattva (Higher than Sattva Guna) and is Krisna’s Presiding Deity of all wealth and prosperity. This very beautiful Laksmi Devî is the complete master of the senses; She is of a very peaceful temper, of good mood and all-auspicious. She is free from greed, delusion, lust, anger, vanity and egoism. She is devoted to Her husband and to Her Bhaktas; Her words are very sweet and She is very dear to Her husband, indeed, the Life and Soul of Him. This Devî is residing in all the grains and vegetables and so She is the Source of Life of all the beings. She is residing in Vaikuntha as Mahâ Laksmî, chaste and always in the service of Her husband. She is the Heavenly Laksmî, residing in the Heavens and the royal Laksmî in palaces and the Griha Laksmî in the several families of several householders. O Nârada! All the lovely beauty that you see in all the living beings and all the things, it is She; She is the glory and fame of those that have done good and pious works and it is She that is the prowess of the powerful kings. She is the trade of merchants, the mercy of the saints, engaged in doing good to others and the seed of dissensions in those sinful and vicious persons as approved of in the Vedas. She is worshipped by all, reverenced by all. Now I will describe to you about the third S’akti of the Great God who is the Presiding Deity of knowledge, speech, intelligence, and learning. This third S’akti is named Sarasvatî. She is all the learning of this endless Universe and She resides as medhâ (intelligence) in the hearts of all the human beings; She is the power in composing poetry; She is the memory and She is the great wit, light, splendour and inventive genius. She gives the power to understand the real meaning of the various difficult Siddhânta works; She explains and makes us understand the difficult passages and She is the remover of all doubts and difficulties. She acts when we write books, when we argue and judge, when we sing songs of music; She is the time or measure in music; She holds balance and union in vocal and instrumental music. She is the Goddess of speech; She is the Presiding Deity in the knowledge of various subjects; in argumentations and disputations. In fact all the beings earn their livelihood by taking recourse to Her. She is peaceful and holds in Her hands Vînâ (lute) and books. Her nature is purely Sâttvic (S’uddha Sattva), modest and very loving to S’rî Hari. Her colour is white like ice-clad mountains, like that of the white sandal, like that of the Kunda flower, like that of the Moon, or white lotus. She always repeatsthe name of Paramâtmâ S’rî Krisna while She turns Her bead composed of jewels. Her nature is ascetic; She is the bestower of the fruits of the ascetism of the ascetics; She is the Siddhi and Vidyâ of all; She grants always success to all. Were She not here, the whole host of Brâhmins would always remain speechless like the dead cluster of persons. What is recited in the Vedas as the Third Devî is the Holy Word, The Third S’akti, Sarasvatî. Thus I have described Her. Now hear the glories of the other Devî in accordance with the Vedas. She is the mother of the four colours (castes), the origin of the (six) Vedâmgas (the limbs of the Vedas and all the Chhandas, the Seed of all the mantrams of Sandhyâ vandanam and the Root, the Seed of the Tantras; She Herself is versed in all the subjects. Herself an ascetic, She is the Tapas of the Brâhmins; She is the Tejas (Fire) and the caste of the Brâhmin caste and embodies in Herself all sorts of Samskâras (tendencies; inclinations); She is the Japam. Pure, known by the names of Sâvitrî and Gâyatrî, She resides always in the Brahmâ Loka (the Sphere of Brahmâ) and is such as all the sacred places of pilgrimages want Her touch for their purification.
1	41-47	Her colour is perfectly white like the pure crystal. She is purely S’uddha Sattva, of the nature of the Highest Bliss; She is eternal and superior to all. She is of the nature of Para Brahmâ and is the bestower of Moksa. She is the Fiery S’akti and the Presiding Deity of the Brahmâ Teja (the fiery spirit of Brahmâ, and the Brâhmanas). The whole world is purified by the touch of Whose Feet, this Sâvitrî Devî is the Fourth S’akti. O Child Nârada! Now I will describe to you about the Fifth S’akti, the Devî Râdhikâ. Hear. She is the Presiding Deity of the five Prânas; She Herself is the Life of all; dearer than life even to S’rî Krisna; and She is highly more beautiful and superior to all the other Prakriti Devîs. She dwells in everything; She is very proud of Her good fortune (Saubhâgyam); Her glory is infinite; and She is the wife, the left body, as it were, of S’rî Krisna and She is not in any way inferior to Him, either in quality or in the Tejas (Fiery Spirit) or in any other thing. She is higher than the Highest; the Essence of all, infinitely superior, the First of all, Eternal, of the nature of the Highest Bliss, fortunate, highly respected, and worshipped by all. She is, the Presiding Devî of the Râsa Lîlâ of S’rî Krisna. From Her has sprung the Râsa mandalam and She is the Grace and the Ornament of the Râsa mandalam (the dance in a circle in Râsa).[Note :-- Extracts from a paper on Creation as explained by Hon’ble Justice Sir G. Woodroffe.The lecturer commenced by pointing out that an examination of any doctrine of creation reveals two fundamental concepts: Those of Being(Kutastha) and Becoming (Bhava); Changelessness and Change; the one and Many. The Brahmân or Spirit in its own nature (Svarupa) is and never becomes. It is the evolutes derived from the Principle of Becoming (Mûlâ Prakriti) which constitute what is called Nature. The latter principle is essentially Movement. The world is displayed by consciousness (chit) in association with Mûlâ Prakriti in cosmic vibration (spandana). Recent Western hypotheses have made scientific “matter” into Mâyâ in the sense that it is but the varied appearances produced in our mind by vibration of and in the single substance ether. The doctrine of vibration (Spandana) is however in India an ancient inheritance. The whole world is born from the varied forms of the initial movement in Mûlâ Prakriti. The problem is how does such multiplicity exist without derogation to the essential unit of its efficient cause, the spirit? The lecturer then made a rapid survey of the Sânkhya philosophy on this point which assumes two real and independent principles of Being and Becoming which it calls Purusa and Prakriti and passed from this the easiest dualistic answer to the pure monism of S’ankara which asserted that there was but one Principle of Being, the Sadvastu and Mâyâ, whether considered as a S’akti of Îs’vara or as the product of such S’akti was Avastu or nothing. He then pointed out that the Tântrik doctrine with which he dealt occupied a middle position between those two points of view. S’iva in the Kulârnava Tantra says “Some desire Monism” (Advaitavâda), others Dualism (Dvaitavâda). Such, however, know not My Truth which is neither Monism nor Dualism (Dvaitâdvaitâ Vivarjita). Tantra is not Dvaitavâda for it does not recognise Prakriti as an independent unconscious principle (Achit). It differs from S’ankara’s Advaitavâda in holding that Prakriti as a conscious principle of Becoming, that is as S’akti, is not Avastu, though its displayed picture, the world is Mâyâ. It effects a synthesis of the S’ânkhya dualism by the conversion of the twin principles of Purusa and Prakriti into the unity which is the Ardhanârîs’vara S’iva S’akti.As regards other matters it adopts the notions of the Sânkhya such as the concepts of Mûlâ Prakriti with the three Gunas, vibration (spandana), evolution (Parinâma) of the Vikritis and the order of emanation of the Tattvas. S’akti which effects this exists and is Herself never unconscious (Achit) though It has the power to make the Jîva think It is such. If this were understood one would not hear such nonsense as that the S’âktas (whose religion is one of the oldest in the world) worship material force or gross matter (Jada).The lecturer then shortly explained the nature of S’akti (S’akti Tattva), a term which derived from the root “S’ak” meant the Divine Power whereby the world was created, manifested and destroyed. In Tantra the power and the Lord who wields it (S’aktimân) are one and the same, S’iva and S’akti are one and the same, S’iva is Brahmân, S’akti is Brahmân. The first is the transcendent, the second the immanent aspect of the one Brahmân, Who is both S’iva and S’akti. The Mother creates (Kârya-Vibhâvinî). The Father wills what She does (Kârya-Vibhâvaka). From their union creation comes. S’akti is not like the diminutive female figure which is seen on the lap of some Indian images, to which is assigned the subordinate position which some persons consider a Hindu wife should occupy. She is not a handmaid of the Lord but the Lord Himself in Her aspect as Mother of the worlds. This S’akti is both Nirguna and Saguna that is Chit S’akti and Mâyâ S’akti.After this defining the nature of S’akti by which the world was created, the lecturer commenced an account of its manifestation as the universe, following in the main the S’âradâ Tilaka written in the eleventh century by Laksmanâchârya, the guru of the celebrated Kashmiran Tântrik, Abhinava Gupta. The following is a very abbreviated summary of this, the main portion of the paper. The lecturer first referred to the Aghanâvasthâ state which was that Niskala S’iva and touching upon the question why S’iva became Sakala (associated with Kalâ) and creative explained the term Kalâ and the theory of Adristasristi taught by the Tantra as by other S’astras. The former is according to Sânkhya, Mûlâ Prakriti; according to Vedânta, Avidyâ and according to the S’iva Tantra, S’akti. The latter is the doctrine that the impulse to creation is proximately caused by the Karma of the Jîvas. It is the seed of Karma which contains the germ of cosmic will to life. When Karma becomes ripe, there arises the state called Îksana and other names indicative of creative desire and will. There then takes place a development which is peculiar to the Tantra called Sadris’a Parinâma, which is a kind of Vivartta. The development is only apparent for there is no real change in the Ânandamaya Kosa. S’akti which exists in Sakala S’iva in a purely potential state is said to issue from Him. This is the first kinetic aspect of S’akti in which Sattaguna is displayed. This is the Paramâkâsâvasthâ. Nâda (sound, word) then appears. S’akti becomes further kinetic through the enlivening of the Rajo Guna. This is the Aksarâvasthâ. Then under the influence of Tamas, Îsvara becomes Ghanibhûta and what is called the Parâvindu. This is the Avyaktâvasthâ. Thus the Supreme Vindu men call by different names, Mahâ Visnu, Brahmâ Purûsa, or Devî. It is compared to a grain of gram which under its sheath contains two seeds in undividedunion. These are S’iva S’akti and their encircling sheath is Mâyâ. This Vindu unfolds and displays itself, in the threefold aspect of Vindu, Vîja, Nâda; or S’iva, S’akti, and S’iva S’akti; the three S’aktis of will, knowledge and action. This is the mysterious Kâma Kalâ which is the root of all Mantras. These seven :-- Sakala, S’iva, S’akti, Nâda, Parâvindu, Vindu, Vîja, Nâda are all aspects of S’akti which are the seven divisions of the Mantra Om and constitute what is called the creation of Parâ sound in the Îs’vara creation.The lecturer having explained the nature of these S’aktis which formed part of the sound (S’abda), Sadrisa Parinâma, referred to the form or meaning (Artha) creation in the same development by the appearance of the six S’ivas from S’ambu to Brahmâ which were aggregate (Samasti) sound powers. It was he said, on the differentiation of the Parâvindu that there existed the completed causal S’abda which is the Hidden Word. The causal body or Parâ S’abda and Artha being complete, there then appeared the displayed word or S’abdârtha. This is a composite like the Greek Logos. The S’abda Brahmân or Brahmân as cause of S’abda is the Chaitanya in all beings. The S’abdârtha in the Vedantin Nâmarûpa or world of name and form of this S’abdârtha the subtle and gross bodies are constituted, the S’aktis of which are the Hiranyagarbha sound, called Madhyamâ and the Virât sound Vaikhârî. By S’abda is not meant merely physical sound which as a quality of atomic ether is evolved from Tâmasik Ahamkâra.The lecturer then pointed out that there had been Adrista Sristi up to the appearance of S’akti and Vivartta development up to the completion of the “word” or causal sound. Then there takes place real evolution (Parinâma) in which the Tattvas (or elements discovered as a result of psychological analysis of our worldly experience) are said to emanate according to the Sânkhya and not the Vedantic scheme, though there were some peculiarities in the Tantrik exposition which the lecturer noted. Finally Yogika Sristi was accepted in so far as it was the elements which in varied combinations made up the gross world.In conclusion the lecturer pointed out that Indian S’âstra was a mutually connected whole. Such peculiarities as existed in any particular S’âstra were due to a variety of standpoints or purpose in view. The main point in this connection to be remembered was that the Tantra was practical S’âdhanâ S’âstra. Whilst S’ankara dealt with the subject from the standpoint of Jñânakânda, the Tantra treated it from the point of view of worship (Upâsanâkânda) the Tantrik doctrine is compounded of various elements some of which it shared with other S’âstras, some of which are its own, the whole being set forth according to a method and terminology which is peculiar to itself.]
1	48-70	She is the Lady of the Râsa Lîlâ, the Foremost of the Jovial, humourous (witty) persons and dwells always in Râsa. Her abode is in Goloka and from Her have come out all the Gopîkâs. Râsa – the circular dance of Krisna and the cow-herdesses of Vrindâvana. Her nature is the Highest Bliss, the Highest Contentment, and Excessive Joy; She transcends the three Sattva, Rajo and Tamo Gunas and is Nirâkâra (without any particular form); but She dwells everywhere but unconnected with any. She is the soul of all. She is without any effort to do anything and void of Ahamkâra. She assumes forms only to show Her favour to Her Bhaktas. The intelligent learned men (Pundits) read Her Mahimâ (glories) in meditating on Her according to the Vedas. The chief of the Devas and the Munis could never see Her; Her clothings are fire-proof and She is decorated with many ornaments all over Her body. Her body looks as if the crores of moons have risen all at once; She is the Giver of Bhakti (devotion) towards Krisna, services towards Krisna; and She bestows all wealth and prosperity. In Varâha Kalpa, i.e., when the Varâha incarnation took place, She incarnated Herself as the daughter of one Gopa (cow-herd), named Vrisabhânu. And Earth was blessed by the touch of Her feet. She is such as Brahmâ and the other Devas could never perceive Her by any of their senses, yet everyone at Vrindâvan saw Her very easily. She is the Gem amongst women. And when She is seen on the breast of Krisna, it seems that lightnings flash in the blue mass of clouds in the sky. In days gone by, Brahmâ practised several austerities for sixty thousand years to purify Himself by seeing the nails of Her toe; but far from seeing that, He could not have that even in his dreams. At last He succeeded in seeing Her at Vrindâvana and became blessed. O Child Nârada! This is the fifth Prakriti and She is denominated as Râdhâ. Every female in every Universe is sprung from a part of S’rî Râdhâ or part of a part. O Nârada! Thus I have described to you the five Highest Prakritis, Durgâ and others. Now I am going to describe those that are parts of these Prakritis. Hear. The Ganges, Gangâ has sprung from the lotus feet of Visnu; Her form is fluid-like; She is eternal. And She is the veritable burning fire to burn away the sins of the sinners. She is sweet to touch in taking baths and in drinking; She gives final liberation to the Jîvas, and leads easily to the Goloka abode. She is the holiest amongst the places of pilgrimage and is the first of the running rivers. She is the rows of pearls in the clotted hairs of Mahâdeva’s head and She is the Tapasyâ (asceticism) incarnate of the Tapasvîs (ascetics) of the Bhârata Varsa. This Ganges purifies the three worlds and is the part of Mûlâ Prakriti; She shines like the Full Moon, is white like white lotus and like milk; She is pure S’uddha Sattva, clear, free from any Ahamkâra, chaste andbeloved of Nârâyana. The Tulasî Devî is the consort of Visnu. She is the ornament of Nârâyana, and dwells always at the lotus feet of Nârâyana. By Her are performed all the acts of worship, all austerities, and all Sankalpas (resolves). She is the chief of all the flowers, holy and able to give merits (Punyam) to others. At Her sight and touch, Nirvâna can be obtained; and, were it not for Her, there could be no other fire in this Kali Yuga to burn the sins. She Herself is of the nature of Fire and at the touch of Whose lotus-feet, the earth is purified; all the Tîrthas desire to have Her sight and touch for purification and without Her all acts in this world become fruitless. She bestows Moksa (liberation) to those who want final liberation, grants all sorts of desires to several people, Who Herself is like a Kalpa Vriksa, Who is the Presiding Deity of all the trees in Bhârata and Who has come here to grant satisfaction to the ladies of Bhârata Varsa and She is considered very superior throughout all parts of India. This Tulasî Devî is the chief factor of Mûlâ Prakriti.
