Chapter	Text_no	Hymn
11	43-69	Bhagavân S’rî Hari said :-- O Sures'varî! I know all that you desire; when you will assume the liquid form, the Salt  Ocean will be your husband. He is My part and you are of the nature of Laksmî; so the union of the lover with the love stricken in the world will turn out a happy and qualified one. Of all the rivers Sarasvatî and others in Bhârata, that go to mix with the ocean, you will be the best and highly fortunate of them all. From today you will have to remain in Bhârata for a period of five thousand years, under the curse of Bhâratî. You will be able to enjoy daily and always the pleasures with the Ocean. O Devî! As you are a clever lady, so He is also apt and expert. The inhabitants of Bhârata will praise Thee and worship Thee with great devotion by the stotra which Bhagîratha has composed. He will derive the fruit of one horse-sacrifice who will meditate on Thee as per Kânvas'âkhâ and worship, praise and bow down to Thee daily. Even if one utter “Gangâ,” “Gangâ,” though one is one hundred Yojanas away from the Ganges, one will be freed of all sins and go to Visnu-loka. Whatever sins will be cast in Thee by thousand sinners bathing in Thee will be destroyed by the touch of the devotees of Prakriti Devî. Even ifthousands and thousands of sinners touch the dead bodies and bath in Thee, all those will be destroyed when the Devî Bhaktas,the worshippers of Bhuvanes'varî and Mâyâ Vîja, will come and touch Thee. O Auspicious One! Thou wilt wash away the sins of the sinners, by Thy stay in Bhârata with other best rivers Sarasvatî and others. That will be at once a sacred place of pilgrimage where Thy glories will be chanted. By the touch of the dust of Thine, the sinner will be at once purified and he will dwell in the Devî-loka (Mani Dvîpa) for as many years as will be the dust there. All Hail to the Devî Bhuvanes'varî! He who will leave his body on Thy lap with full consciousness and remembering My name, will certainly go to My abode and will remain, as My chief attendant for an infinite period. He will see countless Prâkritik Layas (dissolutions of the Universe). Unless a man has collected hordes of religious merits, be cannot die in the Ganges; and if he dies on the Ganges he goes to Vaikuntha as long as the Sun rises in this world. I get many bodies for him where he can enjoy the fruits of his Karma and I then give him My Svârûpya (Form resembling Mine) and make him My attendant. If any ignorant man, void of any Jñânam, quits his body by touching merely Thy water, I give him Sâlokya (place in My region) and make him My attendant. Even if one quits one's body in a far off place, uttering Thy Name, I give him place in My region for one life time of Brahmâ. And if he remembers Thee with devotion, and quits his mortal coil at another place, I give him Sârûpya (Form resembling Mine) for a period of endless Prâkritik Layas. He instantly gets on an aerial car made of jewels and goes with My attendants to the region of Goloka and gets form like Me. Those that worship daily My Mantra, that pass their day eating the remnant of the food offered to Me, they need not have any distinction whether they die in Tîrath or not. They themselves can easily purify the three worlds. Getting on the excellent and best aerial car built of jewels, they go to the region of Goloka. O Chaste One! Even if the friends of My devotees, be born in animal births, they also will be purified by the devotion shown towards Me and getting on a jewelled aerial car will be able to go to Goloka, so diffcult of access. Wherever the Bhaktas may be, if they simply remember Me with devotion, they will become liberated while living by the power of My Bhakti. Thus saying to Gangâ, Bhagavân S’rî Hari addressed Bhagîratha :-- O Child! Now worship Gangâ Devî with devotion and chant hymns to Her. The pure Bhagîrata meditated with devotion as per Kauthuma S'âkhâ and worshipped the Devî and praised Her repeatedly. Then Gangâ and Bhagîratha bowed down to S’rî Krisna and He disappeared at once from their sight.
11	70	The Devarsi Nârada said :-- “O Thou the foremost of the Knowers of the Vedas! How, by what Kuthuma S’âkhâ, the noble King Bhagi-ratha meditated on the Devî Gangâ; what stotra did he recite and what was the method with which he worshipped the Ganges.
11	71-75	Nârâyana said :-- O Nârada! One should first take one's bath, and putting on a clean washed clothing should perform one's daily duties. Then one should control oneself and with devotion worship the six Devatâs Ganes’a, Sun, Fire, Visnu, S’iva and S'ivânî. Thus one becomes entitled to worship. First worship is to be given to Ganes'a for the destruction of obstacles; the Sun is to be next worshipped for health; Fire, for purification; Visnu is then worshipped for getting wealth and power; S’iva is worshipped for knowledge and S'ivânî is worshipped for Mukti. When these Devatâs are worshipped, one is entitled to worship the Deity. Otherwise contrary become the effects. Now I am saying what Dhyânam (meditation) did Bhagîratha practise towards the Devî Gangâ .Here ends the Eleventh Chapter of the Ninth Book on the origin of the Ganges in the Mahâpurânam S’rî Mad Devî Bhâgavatam of Eighteen Thousand verses by Maharsi Veda Vyâsa.
12	1-15	Nârâyana said :-- O Nârada! Now about the meditation (Dhyân) of the Devî Gangâ as per Kânva S'âkhâ, which destroys all the sins, O Gange! Of white colour like white lotuses! Thou destroyest all the sins of men. Thou hast appeared from the body of S’rî Krisna. Thou art powerful like Him. Thou art very chaste and pure. Thou hast worn the raiment, uninflammable and decorated all over with ornaments made of jewels. Thou art more brilliant than one hundred autumnal Moons. Thou art also well pleased with a smile on Thy lips. And Thou art always of steady youthful beauty (that never wanes). Thou art dear to Nârâyana, calm and of peaceful temper, and proud of being His with His fortune. Thou bearest the braid of hair, decked with garlands of Mâlatî flowers; Thy cheeks are anointed with sandal dots, with Sindûra bindu (dots of red powder, vermilion) and well adorned with various artistic lines made of musk. Thy garment and Thy beautiful lips are more red than the ripe Bimba fruit (the red fruit of a cucurbitaceous plant); Thy teeth vie as it were, with the rows of pearls. How lovely are Thy eyes! How delightsome is Thy side-long glance! How close are Thy breasts like Bel fruits! Thy loins are thicker and more solid then the plantain trees. How do Thy feet look beautiful, defying the beauty of the Sthalapadma (ground Lotus)!How do the red sandals look lovely with Kunkuma and alaktak (red powder)! What a red tinge Thy feet have shewn with the honey ofPârijâta flower that is seen on the head of Indra. The Devas, the Siddhas, the Munis, offer always Arghyas (offerings of rice with Durba grass) at Thy feet; the ascetics bow down at Thy feet, and it seems as though so many lines of bees are on Thy lotus feet. O Mother! Thy lotus feet give liberation to those that want Mukti and enjoyment to those that want Bhukti (enjoyments). O Mother! Thou art the boon; Thou art the chief excellent; Thou grantest boons and Thou showest Thy favour to Thy devotees; Thou bestowest the Visnupadam (the place of Visnu); but Thou hast come from the feet of Visnu. Thus meditating on the Devî Gangâ flowing by three routes (in Heaven, earth and infernal regions), the bestower of good things one should offer to the Devî sixteen things :-- Âsana, Pâdya, Arghya, water for bathing, ointment (anûlepana), Dhûpa (scents), Dîpa (lights), Naivedya (offerings of food), betel, cool water, clothings, ornaments garlands, sandal-paste, Âchamanîya (water for sipping), and beautiful beddings and worship Her with these. Then, with folded hands, one should perform stotra to Her and bow down to Her with devotion. Thus the worshipper gets the fruits of A'svamedha sacrifice.
12	16	Nârada said :-- O Lord of the Devas! At present I am desirous to hear the sin-destroying and virtue-bestowing stotra (hymn) of Gangâ Devî, the Purifier of all those that are fallen from virtue, originated from the feet of Visnu, the Lord of world and the husband of Laksmî. Kindly narrate all these in detail.
12	17-41	Nârâyana said :-- O Nârada! Now I am narrating the stotra of Gangâ Devî, that destroys all sins and bestows all religious merit. Hear. I bow down to the Ganges who appeared from the body of S’rî Krisna, enchanted by the music of S'iva, and, who was bathed with the perspiration (water coming out of the body) of S’rî Râdhâ. I bow down to Gangâ Devî who first appeared in the circular dance (Râsa Mândalam) in the region of Goloka and who always remains with S'ankara. My obeisance to the Devî Gangâ who remains in the auspicious grand utsab of Râdhâ (Râsa Mândalam), crowded with Gopas and Gopîs, in the Full Moon night of the month of Kârtik. She is one koti yojanas wide and one lakh times one koti yojanas long in the region of Goloka. My Obeisance to Her! In Vaikuntha, Gangâ is sixty lakh yojanas in width and four times that in length. My Obeisance to Her! In Brahmâ-loka, Gangâ is thirty lakh yojanas wide and five times as long. I bow down to Her. In S'iva-loka, She is thirty lakh yojanas wide and four times that in length. I bow down to Her. In Dhruva-loka, She is one lakh yojanas wide and seven times as long. I bow down to Her. In Chandra-loka She is one lakh yojanas wide and five times as long. My obeisance to S’rî Gangâ Devî. I bow down to the Ganges who is sixty thousand yojanas wide in the Sûrya loka and ten times that in length. I bow down to Gangâ in Tapo-loka who is one lakh yojanas wide and five times that in length. My obeisance to Gangâ Devî in Janar-loka, who is one thousand yojanas wide and ten times that as long. I bow down to Gangâ in Mahar-loka who is ten lakh yojanas wide and five times that in length. My obeisance to Gangâ Devî in Kailâs'a who is one thousand yojanas wide and one hundred times as long. I bow down to Gangâ Devî who is known as Mandâkinî in Indra-loka, and who is one hundred yojanas wide and ten times than that in length. My obeisance to Gangâ Devî, known as Bhogavati in Pâtâla who is ten yojanas wide and five times as long. I bow down to Gangâ Devî, known as Alakanandâ in this earth, who is two miles wide, in some places more wide and in some places less wide. I bow down to Gangâ Devî who was of the colour of milk in Satya yuga, of the colour of Moon in Tretâ Yuga, of the colour of white sandal-paste in Dvâpara yuga. I bow down to S’rî Gangâ Devî who is as water in Kali yuga in this earth and as milk in Kali yuga in Heaven. O Child! By the touch of one molecule of the water of the Ganges, all the horrible sins incurred in ten million births, the murder of a Brâhmin and so forth, are burnt to ashes. Thus I have described in twenty-one verses the great stotra (human) of the sin-destroying and the virtue-increasing merits of Gangâ. He reaps the fruit of the A'svamedha sacrifice (Horse sacrifice), who daily sings this praise of Gangâ after worshipping Her with devotion. There is no doubt in this. The persons that are without any sons get sons hereby and those who have no wives get wives. The diseased get themselves free from their diseases, and the man who is under bondage, is liberated from that bondage. He who getting up early in the morning reads this stotra of Gangâ, becomes widely known even if he be not known at all and he becomes illumined with wisdom even if he be quite ignorant. Even if he sees a bad dream, he acquires the merit of bathing in the Ganges and of seeing good dreams.
12	42-44	S’rî Nârâyana spoke :-- O Nârada! With this stotra (hymn) did Bhagîratha praise the Gangâ Devî. Who then went with him to the spot where the Sagara's sons were burnt to ashes by the curse of Kapila. By the contact of the wind in touch with the particles of water of the Ganges, those sons of Sagara were instantly freed of their curses and they all repaired to Vaikuntha. She is named Bhâgirathî, because Bhagîratha brought Her to this earth. Thus I have described to you the story of the Ganges.This anecdote is highly meritorious and the great step to liberation. What more do you now want to hear? Say.
12	45-46	Nârada said :-- O Lord! How did Gangâ come to flow through the three worlds by three routes, and thus purify them? How was she carried and to which places? How did the people of those localities accord respect to Her? Kindly describe all these in detail.
12	47-79	Nârâyana said :-- O Nârada! On the Full Moon night of the month of Kârtik in the Râsa mândalam, at the great festivity in honour of Râdhâ, S’rî  Krisna worshipped Râdhâ and remained there. Next Râdhâ, worshipped by S’rî Krisna, was worshipped by Brahmâ and the other Devas, by Saunaka and the other Risis, who also stopped there with much gladness. At this moment the Devî Sarasvatî, the Presiding Deity of the Science of Music began to sing lovely songs regarding Krisna, in tune with vocal and instrumental music. Brahmâ became glad and presented to Sarasvatî a necklace of jewels; Mahâ Deva gave her gems and jewels rare in this universe; Krisna presented the best Kaustubha jewel; Râdhikâ offered excellent invaluable necklace of jewels; Nârâyana presented to her the best and most excellent garland of jewels; Laksmî gave her invaluable golden earrings decked with gems; Visnu-Mâyâ Mûla Prakriti, Bhagvatî Durgâ, who is Nârâyanî, Îs'varî, Îs'ânî, presented Her devotion to Brahmâ, so very rare; Dharma gave her devotion to Dharma and high fame; Agni (fire) gave her excellent raiments purified by fire and Vâyu gave Her Nûpura (toe ornaments) made of gems and jewels. At this time, Mahes'vara, the Lord of Bhûtas (elements) began to sing, at the suggestion of Brahmâ, songs relating to S’rî Krisna's grand Râsa festival. Hearing this, the Devas became very much enchanted and remained motionless like statues. With great difficulty, they regained their consciousness. Then they saw that there was no Râdhâ nor Krisna in this Râsa mândala; everything was deluged with water. The Gopas, Gopîs, Devas and Brâhmanas began to cry loudly. Brahmâ in his meditation then came to know that Râdhâ and Krisna both have assumed this liquid appearance for the deliverance of the people of the world. Brahmâ and others, all began to praise S’rî Krisna and said :-- “O All prevading One! Now be pleased to show us Thy form and grant us our desired boons.” At that instant a sweet incorporeal voice was clearly heard by all, as coming from air above, that, “I am the Self of all, pervading all; and this my S’akti, Râdhâ, is also the Self of all, prevades all; so there is no separation of us from you all even for a moment. It is only to show our favour to the devotees that we assume special forms. For this reason only there is separation of us from you as regards this body! There is nothing else. Besides you have no necessity with our bodies. O Devas! Now if my Manus, men, Munis, Vaisnavas and you all, purified by Mantras desire very much to see My Form clearly, then I tell you to request Mahes'vara to carry out My word. O Brahmâ! O Creator! Better askMahâdeva, the World Teacher, that He would better compose the beautiful Tantra S'âstra, in accordance with the limbs of the Vedas. And that the above S'âstra be full of Mantras, capable to yield desired fruits, Stotras (hymns) and Kavachas (protection mantras) and rules of due worship in proper order. And that also My Mantra, My Stotra, and My Kavacha be also given there in a hidden form. So that those people that are sinners might not understand their real meanings and thus turn out against Me. It may be that one in a thousand or in a hundred may worship My Mantra. And My Mantra worshippers, the saints, become purified and come to My Abode. If My S'âstra be not well made (i. e., if everyone be able to understand its meaning) and if everyone be able to go from Bhûrloka to Goloka, then Thy labour in this creation of the world will all be in vain. Therefore dost Thou better create different worlds according to the differences of Sâttvik, Râjasik, and Tamo Gunas; then some will be the inhabitants of this Bhûrloka, some will be the inhabitants of Dyuloka according to their Karmas. O Brâhman! If Mahâ Deva promises earnestly in this assembly of the Devas, I will then exhibit My True Form.” O Nârada! Thus speaking, the Eternal Purusa S’rî Krisna remained silent (i. e., the aerial incorporeal voice stopped). Hearing this, Brahmâ, the Creator of the world, gladly informed S’iva of this. When the Lord of Knowledge, the Foremost of the Jñânins, Bhûtanâtha heard the words of the Creator, He took the Ganges water in His hands and swore that “I will complete the Tantra S'astra, full of Râdhâ mantras and not opposed to the Vedas. If one touches the Ganges water and speaks lies, one remains in the terrible Kâlasutra hell for a period of one Brahmâ's life time.” O Dvija! When Bhagavân S'ankara said this before the assembly of the Devas in the region of Goloka, S’rî Krisna appeared there with Râdhâ. The Devas became exceedingly glad to see Him. They praised Him, the Best Purusa and they were all filled with rapture and again engaged themselves in the grand Râsa Festival. Some time after, Mâhâ Deva lighted the Torch of Mukti, i.e., the Tantra S'âstra was published by Him, as promised. O Child! Thus I have disclosed to you this anecdote, so very secret, and hard to be attained. Thus S’rî Krisna Himself, is verily the liquid Gangâ sprung in the region of Goloka. This holy Gangâ, born of the bodies of Krisna and Râdhâ inseparable from each other, grants enjoyment, lordship and liberation. S’rî Krisna, the Highest Self, has placed Her in various places; so Gangâ is of the nature of S’rî Krisna and is everywhere, equally honoured everywhere in the Brahmânda (universe).Here ends the Twelfth Chapter in the Ninth Book on the origin of Gangâ in the Mahâpurânam S’rîmad Devî Bhâgavatam of Eighteen Thousand verses by Maharsi Veda Vyâsa.
13	1	Nârada said :-- O Lord of the Devas! Kindly say in what Loka did Gangâ go after Five Thousand (five thousand) years of the Kali Yuga?
13	2-4	Nârâyana said :-- The Bhâgîrathî Gangâ came down to Bhârata under the curse of Bhâratî; and when the term expired, She went back, by the Will of God, to the region of Vaikuntha. Also at the end of the period of their curses, Bhâratî and, Laksmî, too, left Bhârata and repaired to Nârâyana. Gangâ, Laksmî, and Sarasvatî, these three and Tulasî all these four are so very dear to S’rî Hari.
13	5-6	Nârada said :-- How did Gangâ appear from the lotus feet of Visnu? Why did Brahmâ put Her in His Kamandalu? I have heard that Gangâ is the wife of S’iva; how then, came She to be the wife of Nârâyana? Kindly describe all these in detail to me.
13	7-8	Nârâyana said :-- O Muni! In ancient times, in the region of Goloka, Gangâ assumed the liquid appearance. She was born of the bodies of Râdhâ and Krisna. So She is of the nature of both of them and their parts. Gangâ is the presiding deity of water. She is unequalled in Her beauty in this world. She is full of youth and adorned with all ornaments.
13	9-43	Her face was like the autumnal mid-day lotus and sweet smile was always reigning on Her lips; Her form was very beautiful; Her colour was as bright as melted gold and She looked brilliant like the Autumnal Moon. Eyes and mind get cool and become pleasant at Her beauty and radiance; She was of purely Suddha Sattva; Her loins were bulky and hard and She was covered with excellent clothings all over Her body. Her breasts were plump and prominent; they were raised, hard, and nicely round. Her eyes very fascinating, always casting sidelong glances. Her braids of hair situated a little oblique and the garland of Mâlatî flowers over it made Her look extremely handsome. The saudalpaste dot and the vermillion dot were seen on Her forehead. On Her cheeks the leaves of musk were drawn and Her lips were red like Bandhûka flowers and they looked enchanting. Her rows of teeth looked like rows of ripe pomegranates; the ends of Her cloth not inflammable by fire, worn in front in a knot round the waist. She sat by the side of Krisna, full of amorous desires, and abashed. She covered Her face with the end of Her cloth and was seeing, with a steadfast gaze the face of the Lord and She was drinking the nectarof His face with great gladness. Her lotus face bloomed and became gladdened at the expectation of a first amorous embrace. She fainted on seeing the Form of Her Lord and a thrill of joy passed all over Her body. In the meanwhile Râdhikâ came up there. Râdhâ was attended by thirty kotis of Gopîs. She looked brilliant like tens of millions of Moons. Seeing Gangâ by the side of S’rî Krisna, Her face and eyes became reddened with anger like a red lotus. Her colour was yellow like champaka and Her gait was like a maddened elephant. She was adorned with various invaluable ornaments made of jewels. Her pair of clothings were tied round Her waist. They were decked with invaluable jewels and not inflammable by fire (fire-proof). The Arghya offered by S’rî Krisna was on Her lotus-feet of the colour of a flowering shrub, Hibiscus mutabilis, and She was going slowly step by step. The Risis began to fan Her with white Châmaras no sooner She, descending from the excellent aeroplane decked with jewels, began to walk. Below the point where the parting of the hairs on the head is done, there was the dot of Sindura on Her forehead. It looked brilliant like a bright lamp flame. On both sides of this Sindurabindu, the dot of musk and the dot of Sandal-paste were seen. When She began to quiver with anger, Her braid, with Pârijâta garland round it began to tremble also. Her lips adorned with beautiful colours, began to quiver also. She took Her seat angrily on a jewel throne by the side of S’rî Krisna. Her attendants took their seats in their allotted positions. Seeing Râdhâ, S’rî Krisna got up at once from His seat with reverence and addressed Her, smiling and began to converse with Her in sweet words. The Gopîs, very much afraid and with their heads bent low, began to chant hymns to Her with devotion. S’rî Krisna also began to praise Her with stotras. At this moment Gangâ Devî got up and praised Her with various hymns and asked Her welfare with fear and with humble words. Out of fear, Her throat, lips and palate were parched up. She took refuge humbly at S’rî Krisna's feet. S’rî Krisna then, took Gangâ Devî on His breast when She became calm and quiet. At this interval Sures'varî Gangâ looked at Râdhâ, seated on a throne, lovely and sweet, as if She was burning with Brahmâ Fire. Since the beginning of creation, She is the Sole Lady of innumerable Brahmâs and She is Eternal. At the first sight, She looked young as if of twelve years old. Nowhere in any Universe can be seen a lady so beautiful and so qualified. She was peaceful, calm and quiet, lovely, infinite and having no beginning nor end. She was auspicious, well endowed with all auspicious signs, prosperous, and having the good fortune of having a besthusband. She was the foremost jewel amongst the ladies and appeared as if all the beauties were concentrated in Her. Râdhâ is the (left) half of S’rî Krisna's body; whether in age or in strength or in beauty she was in every way perfectly equal to S’rî Krisna. Laksmî and the Lord of Laksmî both worship Râdhâ. The excellent brilliance of Srî Krisna was overpowered by the beauty of Râdhâ. Taking Her seat on the throne She began to chew betels offered by Her attendants (Sakhîs). She is the Mother of all the worlds; but no one is Her mother. She is fortunate, respected and proud. She is the Ruling Lady of S’rî Krisna's Life and Soul and ever dearer to Him than His Prâna (vital breath). O Devarsi! Gangâ, the Governess of the Devas, looked at Her over and over again with a steadfast gaze; but Her eyes and mind were not at all satiated. At this moment, Râdhâ addressed smilingly to S’rî Krisna, the Lord of the world, humbly and in sweet words. O My Lord! Who is that Lady sitting by Thy side, looking askance, eager and with a smiling countenance. She is enchanted with Thy beauteous form and fainting away. Her whole body is excited with rapturous joy. Hiding Her face with cloth She is frequently looking at Thee. Thou also dost look on Her smilingly and with desires. What are all these? Even during My presence in this Goloka, all these bad practices are being rampant.
