Chapter	Text_no	Hymn
9	32-40	Vyâsa said :-- Speaking thus in a melodious voice, the Supreme One smiled and again said :-- “This world is all full of error and delusion. Really, it is very wonderful that Brahmâ, Visnu, Indra and other gods are all shuddering out of fear from Mahisa Dânava. The power of Destiny is exceedingly great and terrible; its influence cannot be overcome even by the best of the Devas. O king! The Time is the Lord of happiness and pain; Time is, therefore, the God. The wonder is this that even those who can create, preserve and destroy this world, they are being overpowered and tormented by Mahisa. The Devî, thinking thus, smiled; then laughed and laughed very hoarsely; it seemed that a roar of laughter then arose. And the Dânavas were struck with terror at that very dreadful sound. The earth trembled at that extraordinary sound; the mountains began to move and the vast oceans that remained calm began to be agitated with billows. The uproar filled all the quarters and the mountain Meru trembled. Then the Dânavas, hearing the tumultuous uproar, were all filled with tremendous fear. The Devas became very glad and said thus :-- “O Devî! Let victory be Yours; save us.” The intoxicated Mahisa, too, hearing those words, became very angry. Mahisa, struck with terror at those words, asked the Daityas “O Messengers! Go and ascertain how has originated this sound.
9	41-48	Who has made this harsh sound? Bring that devil who has made this hoarse noise, be he a Deva, Dânava, or anyone else unto me and I will kill that roaring villain, who, it seems, has been puffed with egoism and vanity. The Devas are not making this noise, for they are vanquished and terror-stricken; The Asuras are not doing so, for they are my subjects; then, who is the stupid fellow that has done so? Surely he is of very little understanding; his days are numbered; and I will carry him to the home of Death. Go you, ascertain the cause of sound and come back to me; then I will go there and destroy that wretch who made this noise to no purpose.” Vyâsa said :-- No sooner the messengers heard these words of Mahisa, than they at once went to the Devî and saw that Her body and the several parts thereof were all very beautiful; She had eighteen hands, She was decorated completely with various ornaments all over Her body, all the auspicious signs were being seen in Her body and that She was holding excellent divine weapons. That auspicious Goddess beautiful, was holding in Her hands, the cup and drinking wine again and again. Beholding Her this form, they were afraid and fled at once to the Mahisa and informed him the cause of that sound.
9	49-54	The Daityas said :-- “O Lord! We have seen one grown up woman; whose whereabouts we are quite ignorant. The Devî is decorated with jewels and ornaments all over Her body; She is not human nor Asurî but Her form is extraordinary and beautiful. That noble Lady is mounted on a lion, holding weapons on all Her eighteen hands and is roaring loudly; She is drinking wine; so it seems that She is puffed up with liquor. It is quite certain that She has no husband. The Devas are gladly chanting praises from the celestial space that Let Victory be to Her side and that She save the Devas, O Lord! We don't know at all who is that handsome woman? or whose wife is she; why has she come there? and what is Her motive? Sentiments of love, heroism, laughter, terror and wonder are all fully shining in Her; therefore we are very much overpowered by the halo emitted from Her; and we could not even see Her well.Note :-- Rasas means sentiments. The rasas are usually eight. Sringâra, Hâsya, Karunâ, Raudra, Vîra, Bhayânakâh, Bibhatsâdbhû tasangau, Chetyastau, Natyan, Rasâh smritâh but sometimes Sântarasah, is added thus making the total number nine; sometimes a tenth, Vâtsalyarasa is also added.
9	55	O King! In compliance with your order, we have come back to you no sooner we had seen the Lady, without even addressing Her in any way. Now order us what we are to do.”
9	56-58	Mahisa said :-- “O Best of ministers! O Hero! Under my command, go there with all the forces and use the means, conciliation, etc., and bring that woman, having a beautiful face (like the Moon), to me. If that Lady do not come even when the three policies, Sâma (conciliation), Dâna (making gifts), and Bheda (sowing dissensions in an enemy's party and thus winning him over to one's side, one of the four Upâyas or means of success against an enemy) are adopted by you, then apply the last resort Danda, (or war) in such a way that Her life be not destroyed and bring that beautiful woman to me. I will gladly make Her, of black curling hairs, my queen-consort. In case that deer-eyed one comes gladly, then do my desires without causing any unpleasant feeling; (a cessation of sentiment). I am enchanted on hearing about Her beauties and wealth.”
9	59-67	Vyâsa said :-- The prime minister, on hearing the words of Mahisa, took with him elephants, horses, and chariots and hurriedly went to the desired place. On coming near to the Devî, the minister began to address Her in sweet words from a sufficient distance in a very humble and courteous way. O Sweet speaking! Who art Thou? What has caused Thee to come here? O Highly fortunate! My master has asked through me thesequestions. My master cannot be killed by all the Devas and men; he has conquered all the Lokas (worlds). O Beautiful-eyed! On account of getting his boon from Brahmâ, the Lord of the Daityas has become very powerful and consequently being very proud, assumes different forms at will. He, our King-Emperor Mahisa, the lord of the earth, hearing about Thy beauty and dress, has expressed a desire to see Thee. O Beautiful one! Whether he will appear before Thee in a human form? He will do whatever Thou likest. O Deer-eyed One! Be pleased now to go to that intelligent King. In case Thou dost not go, we will bring the King, Thy devotee, to Thee. O Lord of the Devas! Our King has heard of Thy beauty and grandeur and has become very much submissive to Thee. We will therefore do exactly what Thou desirest. Therefore, Thou having thighs thick and round like those of a young of an elephant! Be pleased to express what Thou likest and we will do quickly as Thoudesirest.Here ends the Ninth Chapter of the Fifth Book on the worship offered by the gods to the Devî and the weapons offered by them in the Mahâ Purânam, S'rî Mad Devî Bhagâvatam, of Eighteen Thousand verses by Maharsi Veda Vyâsa.
10	1-16	Vyâsa said :-- The Mahâ Mâyâ, that Excellent Lady, hearing thus the words of the prime minister of Mahisa, laughed and spoke with a voice, deep like that of a cloud, thus :-- O Minister-in-chief! Know Me as the Mother of the gods; my name is Mahâ Laksmî. It is I that destroy all the Daityas. I am requested by all the Devas to kill Dânava Mahisa; they have been oppressed and deprived of their share of Yajña offerings. Therefore I have come here today alone, without any army to take away his life. O Good One! I am pleased with your sweet words of welcome, in showing me marks of respect. Had you not behaved thus, I would have certainly burnt you to ashes by my fiery sight, which is the universal conflagration at the break up of the world. O Minister! Who is there that gets not pleased with sweet words! Go you to Mahisa and speak to him the following words of mine “O Villain! Go down to Pâtâla (the nether regions) at once if you have any desire to live. Otherwise, I will slay you, the wicked one, in the battle-field; you will have to go to the house of Death, pierced by my mass of arrows. O Stupid One! Know that this is merely kindness shown unto you, that I have told you to go soon to Pâtâla and that the Devas getpossession of their Heaven, with no delay. O One of weak intellect! Therefore dost Thou leave possession of this sea-girt earth and go alone without any delay to Pâtâla, before my arrows are shot at you. O Asura! Or if you desire to fight, then come at once with your powerful warriors; I will destroy all of them. O One of dull intellect! I will kill you in battle, just as I killed before in yugas after yugas countless Asuras like you. O Passionate creature! Better shew that your efforts in holding weapons have been crowned with success by your being engaged in battle against Me; otherwise they will all be useless. O Stupid! You thought that you would be vulnerable alone to women hence you oppressed the Devas entitled to worship; O wicked one! No longer show your pride on the strength of your getting the boon from Brahmâ, that you would be vulnerable only to the females. Thinking it advisable to observe the words of the Creator, I have assumed this incomparable Eternal Female appearance and I have come here to slay you, O wicked one! O stupid one! If you have any desire for your life, then quit this Heaven and go to Pâtâla, infested with snakes, or anywhere else you like.”
10	17-28	Vyâsa said :-- Hearing these words of the Devî, that minister, surrounded by forces, replied in reasonable words thus :-- “O Devî! You are speaking in words befitting a woman and puffed up with pride. You are a woman; the lord of the Daityas is a hero; how can a battle be engaged between you two. It seems to me impossible. Your body is delicate, a girl in full youth; especially you are alone and Mahisa is of huge body and powerful; so the fight comes next to impossibility. He has elephants, horses, chariots, infantry, etc., and countless soldiers all armed with weapons. Therefore, O Beautiful One! He will find no difficulty in killing you in battle as an elephant finds no difficulty in treading over the Mâlati flowers. Rather, if I utter anything harsh to you, that would go against the sentiment of love, with you; therefore I cannot speak rudely to you out of my fear not to interrupt the above feeling. True, that our king is an enemy of the gods; but be has become extremely devoted to you. Therefore it is wise to speak words full of conciliation or generosity. Were it otherwise, I would have shot arrows at you and would have killed you in as much as you have thus boasted in vain and spoken so dire a falsehood, resting merely on the strength of your youthful pride and cleverness. My master has become fascinated on hearing your extraordinary beauty hardly to be seen in this world; it therefore behoves me to speak sweet words to you for the sake of pleasing my master. O Large-eyed! This kingdom and the wealth thereof are all yours; in fact, Mahisa will be your obedient servant; therefore, better forsake your anger, leadingto your death; and cultivate friendship with him. O Sweet Smiling One! I am falling at your feet; you better go to him and become at once queen-consort. O Handsome Woman! No sooner you become the queen of Mahisa than you will get at once all the pure wealth of the three worlds and the unbounding happiness of this world.”
10	29-45	The Devî said :-- “Minister! I now speak what is pregnant with goodness and wisdom to you, according to the rules of the S'âstras, keeping in view also the cleverness that you have shown in using your words. Now I come to understand from your talk, that you are the chief secretary of Mahisa; and therefore your nature and intelligence are like those of a beast. And how can he be intelligent, whose ministership is occupied by a man of your nature! Nature has ordained connection between two persons of like nature. O Stupid One! Did you think a little beforehand the meaning of your words when you told me of my feminine nature? Though I am not apparently a man, yet my nature is that of the Highest Purusa (Man); I shew myself simply in a feminine form. Your master asked before from Brahmâ that he would prefer death, if possible, at the hands of a woman ; therefore, I consider him quite illiterate and ignorant of the sentiment, worthy of a hero. Because to die at the hands of a woman is very painful to one who is a hero; and this is gladly welcome to one who is a hermaphrodite. Now see that your master Mahisa has shown his intelligence, when he courted his death from the hands of a woman. For that very reason, I have come here in the shape of a woman to effect my purpose; why shall I fear, then, to hear your words, contradictory to those of the S'âstras. When Fate goes against any one, a grass comes like a thunderbolt; and when fate goes in favour of anyone, a thunderbolt becomes as soft as a bundle of cotton. What does it avail even when one possesses an extensive army or various weapons in abundance, taking shelter in a wide extending fort? What will his soldiers do to him, whose death has come close at hand? Whenever, in due time, the connection of the Jîva (the human soul) with this body is brought about, then his pleasures, pains and death are written. Know this as certain, very certain, that death will come to  him in the manner as written by the hands of Fate; it will never be otherwise. As the birth and death of Brahmâ and other gods are ordained, your death has been similarly ordained; no, there is no need of taking the example further than this. Those who are tied up by the hands of death are surely fools and of extremely blunt intellect, if they think simply on the strength of their getting some boons “that they would never die.” Therefore go quickly to your king and speak to him what I have said; you will then surely obey what he commands you to do. If he wantshis life, he, with his retinue, would at once go down to Pâtâla; let Indra and the other Devas get possession of the Heavens and their share of Yajñas. If he holds a contrary opinion, let him be eager to go to the house of Death and come and fight with Me. If he thinks that Visnu and the other Devas have fled from the battle-fields, he has nothing to boast of; for he has not shewn his manliness at all even then; for his victory is solely due to his having got the boon from Brahmâ.”
10	46-52	Vyâsa said :-- Hearing these words of the Devî, the Dânava began to think whether I ought to fight or to go to Mahisa? The King has become very enamoured and has sent me hither to negotiate for marriage; how then will I be able to go to him if I make this affair unpleasant and interrupted in the middle in its course of harmony. Now it is wise for me to go to the King without fighting; let me then go as early as possible in this way and inform him about this whole affair. The King is exceptionally intelligent and experienced; he will consult with his other experienced ministers and do what is best. Therefore I ought not to fight here rashly; for victory or defeat would alike be distasteful to my monarch. Whether this Lady kills me, or I kill this Lady, the king will be angry in either case. I will therefore go now to the king and tell him what the Devî has said; he will do whatever he likes.
10	53-66	Vyâsa said :-- Thus that intelligent son of the minister argued and went to the king. Then, bowing down before him, he began to say thus :-- O King! That excellent woman, fascinating to the world, the beautiful Devî is sitting on a lion with weapons in all her eighteen hands. O King! I told her “O Beautiful Lady! Be attached to Mahisâsura; you will become, then, the queen-consort of the king, the lord of the three worlds. You will certainly then be his queen-consort; he will pass his life, ever obedient to you like an obedient servant. O Beautiful One! If you choose to make Mahisa your husband, you will become fortunate amongst women and will enjoy ever all the wealth of the three worlds.” Hearing my these words, that large-eyed woman, puffed up with egoism, laughed a little and said thus :-- “Your king is born of a buffalo and is the worst of brutes; I will sacrifice him before the Devî for the benefit of the gods. Is there any woman in this world so stupid as to select Mahisa as her husband? O You stupid! Can a woman like me ever indulge in bestial sentiments! A female buffalo has got horns; she, being excited with passion, may select your Mahisa with horns as her husband and come to him bellowing. I am not stupid nor like her so as to make him my husband. O Villain! I will fight and destroy the enemies of the gods in the battle-field. Orif he desires to live, let him flee to Pâtâla. O King! Hearing those rough words uttered by Her in a moment of madness, I have come to you, thinking also how to redress this wrong. O King! Only I feared not to interrupt in your love sentiment; and therefore I did not fight with Her; especially, without Your command, how can I engage myself in useless excitement? O Lord of the Earth! That handsome woman rests maddened on Her own strength; I do not know what is in the womb of future or whatever is destined to happen, will surely come to pass. You are the sole master in this matter; I will do whatever you order me. The matter is very difficult to be reflected upon; whether it is better to fight or it is better to fly away, I cannot say definitely.”Here ends the Tenth Chapter of the Fifth Skandha on the messenger's news to Mahisa, in S'rî Mad Devî Bhâgavatam the Mahâ Purânam, of Eighteen Thousand verses by Maharsi Veda Vyâsa.
11	1-3	Vyâsa said :-- The King Mahisâsura, maddened with pride, heard the messenger’s words and called the aged and experienced ministers and said thus :-- O Ministers! What am I to do now? Better judge you all well, and speak out definitely to me. Is it that this Devî has been created by the Devas like the Mâyâ of Sambarâsura and thus has appeared before us? You are all dexterous and know where to apply the four means of success, viz., conciliation, gift or bribery, sowing dissensions, and war; and therefore you would better tell me which one of the above four, I am to adopt now.
11	4-7	The ministers said :-- O King! One should always speak true and at the same time pleasant; the wise ones should then select only those which are beneficial and apply them. O King! As a medicine, though bitter, cures diseases, so true words, though appearing unpleasant, lead to beneficial results. Those that are simply pleasant, are generally injurious as to their effects. O Lord of the Earth! The bearers and approvers of truth both are very rare; truth speakers also are very difficult to be seen; laudatory sycophancy is found in a great measure in this world. O King! Nobody in the three worlds knows what will be good or what will lead to inauspicious results? How can we then definitely pronounce our judgment in this difficult matter?
11	8-9	The King said :-- Let each of you say separately, according to his own intellect, what is his opinion; I will hear them all and considerfor myself. Clever persons should hear the opinions of several persons, then judge for himself what is the best and then adopt that as what is to be done.
11	10	Vyâsa said :-- Hearing his words, the powerful Virûpâksa came out foremost of all and began to say pleasant words to the King.
11	11-16	O King! Please take for certain, what has been spoken by that ordinary woman, swelled with vanity, as words simply to scare you. The efforts and courage of a woman are known to all; who will be afraid therefore, to hear abusive language from a woman, praising her ownself in matters of warfare? O King! You have conquered the three worlds by your own heroic valour; now if you acknowledge your inferiority, out of fear to a woman, you would be subject to very much disgrace in this world. Therefore, O King! I will go alone to fight with Chandikâ and I will kill Her. You can stay here now without any fear. O King! See my prowess now; I am just now going with my army and I will kill that violent Chandikâ, maddened with pride, or I will tie Her down by a coil of snakes and bring Her before you; then that Lady, seeing Herself helpless, will become quite submissive to you; there is no doubt in this.
11	17-30	Vyâsa said :-- Hearing these words of Virûpâksa, Durdhara said :-- O King! Virûpâksa is very intelligent; what he has said just now is all reasonable and true. O King! You are intelligent; hear my words full of truth also. As far as I think, I consider that woman with beautiful teeth as passionate. For that woman of broad hips has expressed a desire to bring you under control by making you fearful; the mistresses, proud of their beauty generally use such words when they become passionate. When they behave in this way, people call these amorous gestures. These crooked words of mistresses are the chief causes in attracting dear persons unto them. Those who are skilled in the art of love affair, some of them can know these things thoroughly well. O King! That woman has said, “I will pierce and kill you by arrows, face to face, in the battlefield.” The sense of this is different. The wise persons that are clever and experienced in the art of finding out the cause, declare that the above sentence is pregnant with deep and esoteric meaning. You can easily see that the handsome women have no other arrows with them; their side-glances are their arrows. And their words carry their hidden meanings, and, expressing their desires, are their flowers. O King! Brahmâ, Visnu and Mahes’a even have no powers to shoot arrows at you; how can, then, that helpless woman, who appears so passionate, dart real arrows at you? O King! That lady said :-- “O Stupid! I will kill your King by my arrow-like eye-sight.” But the messenger was wanting in that power to appreciate; so he, no doubt, understood her words in theircontrary sense. The saying of that lady, “I will lay your lord in the death-bed in the battle-field” is to be taken in the light of inverted sexual intercourse, where woman is above the man. Her utterance, “I will take away the vitality (life) of your lord” is also significant. The semen virile is known as the vitality (life). Therefore the above expression means that she will make you devoid of your virility. There can be no other meaning. O King! Those women that are excellent shew by too much of their covert expressions (innuendos) that they select and like very much their beloved. The experts only in these amorous affairs will be able to appreciate these things. Knowing thus, dealings ought to be made with Her so that the harmony in amorous sentiments be not broken. O King! Sâma (conciliation) and Dâna (gifts) are the two means to be adopted; there is no other way. By these two, that Lady, whether she be proud or angry, is sure to have brought under control; I will go now and bring Her before you by such sweet words. O King! What is the use of my talking too much? I will make Her submissive to you like a slave girl.
11	31-44	Vyâsa said :-- Hearing those words of Durdhara, the Dânava Tâmra, who was very experienced in finding out the real nature, said :-- “I am telling you what is sanctioned by virtue and is at the same time full of sweet amorous feelings, pregnant with deep meanings. Kindly hear; O Giver of honour! This intelligent woman is not at all passionate nor devoted to you; nor has that woman used any covert expressions to you. O Great Hero! This is strange indeed that a Lady, beautiful, handsome, and of strange features, at the same time alone and helpless, has come here to fight. A good-looking woman, powerful, and having eighteen hands is never heard of, nor ever seen by me in these three worlds. She is holding in each of Her hands powerful weapons. O king! All these seem to be the contrary actions of Time. O King! I saw ominous dreams during the night; and I conclude, therefore, that great dangers are over our heads. Early in the morning twilight, I saw in my dream that a woman, wearing a black raiment, was weeping in the inner courtyard; that some inauspicious events are forthcoming can be easily judged from the above. O King! The birds were screaming hoarsely in every house and various calamitous events were seen in various houses; at this time that woman, firmly resolved, was challenging you to fight; it, therefore seems to me that there is something very serious in this matter. O Lord! This woman is neither human, nor a Gandharvî, nor the wife of any Asura. Only to cause delusion to us, she, this wondrous Mâyâ has been created by the gods. O King! In no case, weakness is to be resorted; it is wise by all means to fight as best as possible; what is inevitable will come to pass; this is my opinion. No one is able to unriddle the doingsof the Devas, whether they would be auspicious or inauspicious. Therefore intelligent ones should weigh pros and cons carefully and remain patient and steady. O King! Life or death is at the hands of Destiny; Nobody, therefore, can do it otherwise.”
11	45-51	Hearing this, Mahisâsura said :-- “O Highly fortunate Tâmra! Better, then, stand for fight, fully resolved and go to that Lady, beautiful, and conquer Her according to rules of justice and bring Her before me. In case She does not come under your control in fight, kill Her; but if She comes round, then show Her honour; do not kill Her. O All-knowing! You are a great hero and at the same thoroughly conversant with Kâma S’âstra (science of love); therefore conquer that Fair One by any means you can. O valiant Tâmra, of mighty prowess! Go then with a mighty force and ponder over again and again and find out Her intention. Is She prompted by passion or by real inimical feeling or by any other motive? Try to find out whose Mâyâ is this? Know all these beforehand; then find out the remedy; next fight with Her according to your strength and prowess. Weakness should not be shown nor merciless behaviour is to be resorted; you should behave with Her according to the bent of Her mind.”
11	52	Vyâsa said :-- O king! Thus hearing the King’s words, Tâmra coming as if under the sway of Death, saluted the king Mahisa and marched away with his army.
