Chapter	Text_no	Hymn
38	7-79	Dharmarâja said :-- O Child! What boons you desired of Me before, I granted them all to you. Now I grant this boon to you that, “Let the devotion towards the S’akti now arise in your mind.” O Auspicious One! You want to hear the reciting of the Glories of S’rî Devî; by this, both he who puts forward the question and he who hears the answer, all their families are delivered. When the S’esa Nâga Ananta Deva with His thousand mouths is unable to recite the glories of the Devî, when Mahâdeva cannot describe with His five mouths, when the Creator Brahmâ is incapable to recite Her glories with His four mouths, when Visnu, the Omniscient, falls back, when Kârtîkeya with His six mouths cannot sufficiently describe, when Ganes’a, the Guru of the Gurus of the great yogis is incapable, when the Pundits, the knowers of the four Vedas, the Essence of all the S’âstras, cannot know even a bit of Her, when Sarasvatî becomes inert in going to describe Her glories; when Sanatkumara, Dharma, Sanâtana, Sananda, Sanaka, Kapila, Sûrya and other sons of the Creator have fallen back, when the other Siddhas, Yogîndras, Munîndras are quite incapable to glorify the deeds of Prakriti Devî, then how can I recite fully the Glories of Her? Whose lotus-feet Brahmâ,Visnu, S’iva and others meditate; and lo! when it becomes difficult for Her devotees even to think of Her, then what wonder is there that She will be so very rare to others! Brahmâ, skilled in the knowledge of the Vedas knows more of Her than what other ordinary persons know so little of Her auspicious Glories. More than Brahmâ, Ganes’a, the Guru of the Jñânins, knows; again S’ambhu, the Omniscient, knows the best of all. For, in ancient times, the knowledge of the Prakriti Devî was given to Him by Krisna, the Highest Spirit in a solitary place in the Râsa Mandalam in the region of Goloka. Mahâdeva, again, gave it to Dharma in the S’ivaloka; Dharma again gave the Prakriti Mantra to My father. My father became successful (Siddha) in the worship of Prakriti Devî when he practised austerities. Of old, the Devas wanted to offer to me the Government of the Yama Loka; but as I was very much dispassionate towards the world, I became unwilling and became ready to perform austerities. Then my Father told the Glories of Prakriti Devî. Now I describe to you what I heard from my Father and what is stated in the Vedas, though very difficult to comprehend. Listen carefully. O Fair Faced One! As the eternal space does not know its own extent, so Prakriti Devî Herself knows not Her own Glories; then what can be said of any other person on this! She is the Self of all, endowed with all powers and lordship, the Cause of all causes, the Lord of all, the Origin of all and the Preserver of all; She is Eternal, always with Her Cosmic Body, full of everlasting bliss, without any special form, unrestrained, having no fear, without any disease and decay, unattached, the Witness of all, the Refuge of all, and Higher than the Highest; She is with Mâyâ and She is Mûla Prakriti; the objects created by Her being known as the Prakriti creation; Who remains as Prakriti and Purusa inseparable from each other as Agni and Her burning force; the Mahâ Mâyâ, of the nature of everlasting existence, intelligence and bliss. Though formless, She assumes forms for the gratification of the desires of Her Bhaktas. She created first the beautiful form of Gopâla Sundarî, i.e., the form of S’rî Krisna very lovely and beautiful, captivating the mind. His body is blue like the fresh rain cloud; He is young and dressed like that of a cow herd. Millions of Kandarpas (the Love deity) are, as it were, playing in his body. His eyes vie with the midday lotus of the autumn. The beauty of His face throws under shade the millions and millions of the Full Moon. His body is decorated with invaluable ornaments decked with jewels. Sweet smile reigns ever in His lips; it is adorned moreover with His yellow coloured invaluable robe. He is Parama Brahmâ. His whole body is burning with the Brahmâ Teja, the Fire of Brahmâ.His Body is Fiery. He is lovely, sweet to look at, of a peaceful temper, the Lord of Râdhâ and He is Infinite. (Note :-- The Universe; as we see, is unreal like what we see in the kaleidoscope; various apparent pictures of an endless variety of beautiful colours and forms.) He is sitting on a jewel throne in the Râsa Mandalam, and is incessantly looked upon by the smiling lovely Gopîs at one and the same time. He is two-armed. A garland made of wild flowers is hanging from His neck. He is playing on His flute. His breast is resplendent with Kaustubha gem that He always wears. His body is anointed with Kunkuma (saffron), aguru (the fragrant and cooling paste of the Aguru wood), musk, and sandal-paste. The garland of beautiful Champaka and Mâlatî flowers is hanging from His neck. On His head, the beautiful crest is being seen, a little obliquely situated in the form of the beautiful Moon. Thus the Bhaktas, filled with Bhaktis, meditate on Him. O Child! It is through His fear that the Creator is doing His work of creation of this Universe; and is recording the Prârabdha fruits of their Karmas. It is through His fear that Visnu is awarding the fruits of Tapas and preserving the Universe. By His command the Kâlagni Rudra Deva is destroying all. By Whose favour S’iva has become Mrityumjaya, the Conqueror of Death and the Foremost of the Jñânins; knowing whom S’iva has become Himself endowed with knowledge and the Lord of the knowers of knowledge, full of the Highest Bliss, devotion and dispassion. Through Whose fear the wind becomes the foremost of runners and carries things, the Sun gives heat, Indra gives rain, Yama destroys, Agni burns, and Water cools all the things. By Whose command the Regents of the (ten) quarters of the sky are watching and preserving nice orders; through Whose fear the planets are describing their several orbits. Through Whose fear, trees flower and yield fruits; By Whose command the Kâla destroys all. By Whose command all the beings whether on land or in water are quitting their lives in time; until the proper time comes no man does not die even if he be pierced whether in battle or in danger. By Whose command the wind supports the water; the water supports the tortoise; the tortoise supports the Ananta and the Ananta supports the earth; the earth supports the oceans, mountain and all the jewels. The earth is of the nature of forgiveness, i.e., endures all. For this reason all things, moving and non-moving, rest on Her and again melt away in Her. Seventy-one Divine Yugas constitute one Indra’s life period. Twenty-eight Indra’s life periods constitute Brahmâ’s one day and one night. Thus thirty days constitute Brahmâ’s one month; so two months constitute one Ritu (season); six Ritus make one year. Thus one hundred years constitute Brahmâ’slife. When Brahmâ dies, S’rî Hari’s eye closes. That is the Prâkritik Pralaya. At this time, everything, moving and non-moving, from the Deva loka to Bhûr loka (earth) dies. The Creator Brahmâ gets dissolved in the navel of S’rî Krisna. The four-armed Visnu, of Vaikuntha, sleeps on Ksîra Samudra, the ocean of milk, i.e., He dissolves on the left side of S’rî Krisna, the Highest Spirit. All the other S’aktis (forces) dissolve in Mûla Prakriti, the Mâyâ of Visnu. The Mûla Prakriti Durgâ, the Presiding Deity of Buddhi (reason) dissolves in the Buddhi of Krisna. Skanda, the part of Nârâyana, dissolves in His breast. Gane’sa, the foremost of the Devas, born in part of Krisna, dissolves in the arm of S’rî Krisna. And those who are born in parts of Padmâ, dissolve in Her body and Padmâ dissolves in the body of Râdhâ. All the cow-herdesses and all the bodies of the Devas dissolve in Râdhâ’s body. But Râdhâ, the Presiding Deity of the Prâna of S’rî Krisna, dissolves in the Prâna of S’rî Krisna. Sâvitrî, the four Vedas and all the S’âstras dissolve in Sarasvatî; and Sarasvatî gets dissolved in the tongue of S’rî Krisna, the Highest Self. The Gopâs in the region of Goloka dissolve in the pores of His skin; the Prâna Vâyu of all dissolve in His Prâna Vâyu; the fire dissolves in the fire in His belly; water dissolves in the tip of His tongue, and the Vaisnavas, (devotees of Visnu), drinking the nectar of Bhakti, the Essence of all essences, dissolve in His lotus-feet. All smaller Virâts dissolve in the Great Virât and the Great Virât dissolves in the Body of S’rî Krisna. O Child! He is Krisna, on the pores of Whose skin are situated endless Universes; at the closing of Whose eyes, the Prâkritic Pralaya comes and on the opening of Whose eyes, the creation takes place. The closing and opening of the eyes takes the same time. Brahmâ’s creation lasts one hundred years and the Pralaya lasts one hundred years. O One of good vows! There is no counting how many Brahmâs or how many creations and dissolutions have taken place. As one cannot count the number of dusts, so one cannot count the creations and dissolutions. This is the Great Unspeakable Wonder! Again on Whose closing of the eyes the Pralaya takes place and on whose opening of the eyes the creation takes place, out of the will of God, That Krisna dissolves at the time of Pralaya in Prakriti. This Highest S’akti, the Mûla Prakriti is the Only One without a second; it is the only one Nirguna and the Highest Purusa. It is considered as “Sat” existing, by the Seers of the Vedas. Such a thing as Mûla Prakriti is the unchanged state (Mukti). During the Pralaya, this only One Mûla Prakriti appears as Jñâna S’akti or the Knowledge Force. Who can in this universe recite Her glories? Mukti is of four kinds.  Sâlokya,  Sârûpya,  Sâmîpya and  Nirvâna. So it is stated in the Vedas. Out of them Bhakti towards the Deva is the highest; so much so that the Deva Bhakti is superior to Mukti. Mukti gives Sâlokya, Sârûpya, Sâmîpya, and Nirvâna. But the Bhaktas do not want anything. They want service of the Lord. They do not want anything else. The state of becoming S’iva, of becoming an Amara or an immortal, becoming a Brahmâ, the birth, death, disease, old age, fear, sorrow, or wealth, or assuming a divine form, or Nirvâna or Moksa all are looked on alike by the Bhaktas with disregard and contempt. Because Mukti is without any service while Bhakti increases this service. Thus I have told you the difference between Bhakti and Mukti. Now hear about the cutting off of the fruits of the past Karmas. O Chaste one! This service of the Highest Lord severs the ties of Karmas (past acts). This service is really the True Knowledge. So, O Child! I have now told you the Real Truth, leading to auspicious results. Now you can go freely as you desire. Thus saying to Sâvitrî, Yama, the son of Sûrya, gave life back to her husband and blessing her, became ready to go to His own abode. Seeing Dharmarâja ready to go away, Sâvitrî became sorry to have the bereavement of a good company, bowed down at His feet and began to cry. Yama, the Ocean  of Mercy, hearing the crying of Sâvitrî began to weep and told the following words :--
38	80-96	Dharma said :-- O Child! You enjoy in this holy Bhârata happiness for one lakh years and you will in the end go to the Devîloka or Mani Dvîpa. Now go back to your house and observe for fourteen years the vow called Sâvitrî-vrata for the mukti of women. This Vrata is to he observed on the fourteenth day of the white fortnight in the month of Jyaistha. Then observe the Mahâ-Laksmî Vrata. Its proper time is the eighth day of the bright fortnight of the month of Bhâdra. For sixteen years consecutively without any break this vow is to be observed. The woman who practises with devotion this vow, goes to the abode of Mûla Prakriti. You would worship on every Tuesday in every month the Devî Mangala Chandikâ, the giver of all good; on the eighth day in the bright fortnight you should worship Devî Sâsthî (i.e., Devasenâ); you should worship Manasâ Devî, the giver of all siddhis, on the Samkranti day (when the Sun enters another sign) in every year; you should worship Râdhâ, the Central Figure of Râsa, more than the Prâna of Krisna on every Full Moon night in the month of Kârtik and you should observe fasting on the eighth day in the bright fortnight and worship the Visnu Mâyâ Bhagavatî Devî, the Destructrix of all difficulties and dangers. (Note :-- The Râsa is the playing out of the Vedantic saying of Brahmâ as “Raso vai Sah.” He is of the nature of Râsa, the most sweet and lovely Divine Principle which unites the Rasika and the Rasikâ.) The chaste woman having husband and sons who worships the World Mother Mûla Prakriti, whether in Yantra, or in Mantra or in image, enjoys all pleasures in this world; and, in the end, goes to the Devîloka or Mani Dvîpa. O Child! The worshipper Sâdhaka (one who is in one’s way to success) must worship all the manifestations of the Devî, day and night. At all times one must worship the omnipresent Durgâ, the Highest Îsvarî. There is no other way to attain blessedness than this. Thus saying, Dharmarâja went to His own abode. Sâvitrî, too, with her husband Satyavân went to her home. Both Sâvitrî and Satyavân, when they reached home, narrated all their stories to their friends and acquaintances. In time, by the blessing of Yama, Sâvitrî’s father got sons and father-in-law recovered his eye-sight and kingdom and Sâvitrî Herself got sons. For one lakh years, Sâvitrî enjoyed pleasures in this holy land of Bhârata, and ultimately went with her husband to the Devîloka. Sâvitrî is the Presiding Deity of the Sûryamandalam, the solar orb. The Sun is the central Para Brahmâ. The Gâyatrî Mantra, the Presiding Devî, proves the existence of the highest Brahmâ in the centre of the Sun. Therefore She is called Sâvitrî. Or Her name is Sâvitrî because all the Vedas have come out of Her. Thus I have narrated the excellent anecdote of Sâvitrî, and the fruitions of the Karmas of the several Jîvas. Now what more do you want to hear? Say.Here ends the Thirty-eighth Chapter in the Ninth Book on the glories of the Devî and on the nature of Bhakti in the Mahâ Purânam S’rî Mad Devî Bhâgavatam of Eighteen Thousand verses by Maharsi Veda Vyâsa.
39	1-3	Nârada said :-- “O Lord! I have heard in the discourse on Sâvitrî and Yama about the Formless Devî Mûla Prakriti and the glories of Sâvitrî, all true and leading to the endless good. Now I want to hear the story of the Devî Laksmî. O Thou, the Chief of the knowers of the Vedas! What is the nature of Laksmî? By whom was She first worshipped? and by what Mantra? Kindly describe Her glories to me.”
39	4-33	Nârâyana said :-- Of old, in the beginning of the Prâkritik Creation, from the left side of Krisna, the Supreme Spirit, appeared in the Râsamandalam (the Figure Dance) a Devî. She looked exceedingly handsome, of a dark blue colour, of spacious hips, of thin waist, andwith high breast, looking twelve years old, of steady youth, of a colour of white Champaka flower and very lovely. The beauty of Her face throws under shade millions and millions of autumnal full moons. Before Her wide expanded eyes, the midday lotus of the autumnal season becomes highly ashamed. By the Will of God, this Devî suddenly divided Herself into two parts. The two looked equal in every respect; whether in beauty, qualities, age, loveliness, colour, body, spirit, dress, ornaments, smile, glance, love, or humanity, they were perfectly equal.Now she who appeared from the right side is named Râdhâ and she who came from the left side is named Mahâ Laksmî. Râdhâ wanted first the two armed S’rî Krisna, Who was Higher than the highest; then Mahâ Laksmî wanted Him. Râdhâ came out of the right side and wanted first Krisna; so Krisna, too, divided himself at once into two parts. From His right side came out the two-armed and from his left side came out the four-armed. The two-armed person first made over to Mahâ Laksmî the four armed One; then the two armed Person Himself took Râdhâ. Laksmî looks on the whole universe with a cooling eye; hence She is named Laksmî and as She is great, She is called Mahâ Laksmî. And for that reason the Lord of Râdhâ is two-armed and the Lord of Laksmî is four-armed. Râdhâ is pure Aprâ kritic S’uddha Sattva (of the nature of pure Sattva Guna, the illuminating attribute) and surrounded by the Gopas and Gopîs. The four-armed Purusa, on the other hand, took Laksmî (Padmâ) to Vaikuntha. The two-armed person is Krisna; and the four-armed is Nârâyana. They are equal in all respects. Mahâ Laksmî became many by Her Yogic powers (i.e., She remained in full in Vaikuntha and assumed many forms in parts). Mahâ Laksmî of Vaikuntha is full, of pure Sattva Guna, and endowed with all sorts of wealth and prosperity. She is the crest of woman-kind as far as loving one’s husbands is concerned. She is the Svarga Laksmî in the Heavens; the Nâga Laksmî of the serpents, the Nâgas, in the nether regions; the Râja Laksmî of the kings and the Household Laksmî of the householders. She resides in the houses of house-holders as prosperity and the most auspicious of all good things. She is the progenetrix, She is the Surabhi of cows and She is the Daksinâ (the sacrificial fee) in sacrifices. She is the daughter of the milk ocean and she is Padminî, the beauty of the spheres of the Moon and the Sun. She is the lustre and beauty of the ornaments, gems, fruits, water, kings, queens, heavenly women, of all the houses, grains, clothings, cleansed places, images, auspicious jars, pearls, jewels, crest of jewels, garlands, diamonds, milk, sandal, beautiful twigs, fresh rain cloud, or of all other colours. She was first worhipped in Vaikuntha by Nârâyana. Next She was worshipped by Brahmâ and thenby S’ankara with devotion. She was worshipped by Visnu in the Kshirode Samudra. Then she was worshipped by Svâyambhuva Manu, then by Indras amongst men, then by Munis, Risis, good householders, by the Gandharbas, in the Gandharbaloka; by the Nâgas in the Nâgaloka. She was worshipped with devotion by Brahmâ for one fortnight commencing from the bright eighth day in the month of Bhâdra and ending on the eighth day of the dark fortnight in the three-worlds. She was worshipped by Visnu, with devotion in the three worlds on the meritorious Tuesday in the months of Pausa, Chaitra, and Bhâdra. Manu, also, worshipped Her on the Pausa Sankrânti (the last day of the month of Pausa when the Sun enters another sign) and on the auspicious Tuesday in the month of Mâgha. Thus the worship of Mahâ Laksmî is made prevalent in the three worlds. She was worshipped by Indra, the Lord of the Devas and by Mangala (Mars) on Tuesday. She was then worshipped by Kedâra, Nîla, Subala, Dhruva, Uttânapada, S’akra, Bali, Kas’yapa, Daksa, Kardama, Sûrya, Priyavrata, Chandra, Vâyu, Kuvera, Varuna, Yama, Hutâsana and others. Thus Her worship extended by and by to all the places. She is the Presiding Deity of all wealth; so She is the wealth of all.Here ends the Thirty-ninth Chapter of the Ninth Book on the story of Mahâ Laksmî in the Mahâ Purânam S’rî Mad Devî Bhâgavatam of Eighteen Thousand verses by Maharsi Veda Vyâsa.
40	1-2	Nârada said :-- “O Lord! How did the eternal Devî Mahâ Laksmî the dweller in Vaikuntha, the beloved of Nârâyana, the Presiding Deity of Vaikuntha, come down to the earth and how She, became the daughter of the ocean? By whom was She first praised? Kindly describe all these in detail to me and oblige.”
40	3-10	Nârâyana said :-- O Nârada! In ancient days when on Durvâsâ’s curse, Indra was dispossesed of his kingdom, all the Devas came down to earth. Laksmî, too, getting angry, quitted the Heavens, out of pain and sorrow and went to Vaikuntha and took the shelter of Nârâyana. The Devas, then, went to Brahmâ with their hearts full of sorrow and, taking Him from there, they all went to Nârâyana in Vaikuntha. Going there they all took refuge of the Lord of Vaikuntha. They were very much distressed and their throats, palate and lips were quite dry. At that time Laksmî, the wealth and prosperity of all, came down on earth by the command of Nârâyana and became born in part as the daughter of the ocean. The Devas, then with the Daityas churned the Ksîroda Ocean and, out of that, MahâLaksmî appeared. Visnu looked on Her. Her joy knew no bounds. She smiling, granted boons to the Devas and then offered a garland of flowers on the neck of Nârâyana (as a symbol of marriage celebrated). O Nârada! the Devas, on the other hand, got back their kingdoms from the Asuras. They then worshipped and chanted hymns to Mahâ Laksmî and since then they became free from further dangers and troubles.
40	11-12	Nârada said :-- “O Bhagavân! Durvâsâ was the best of the Munis; he was attached to Brahmâ and had spiritual knowledge. Why did he curse Indra? What offence had he committed? How did the Devas and Daityas churn the ocean? How, and by what hymns Laksmî became pleased and appeared before Indra? What passed on between them. Say all this, O Lord.”
40	13-25	Nârâyana said :-- In ancient days, Indra the Lord of the three worlds, intoxicated with wine and becoming lustful and shameless, began to enjoy Rambhâ in a lonely grove. After having enjoyed her, he became attracted to her; his mind being wholly drawn to her, he remained there in that forest, his mind becoming very passionate. Indra then saw the Muni Durvâsâ on his way from Vaikuntha to Kailâs’a burning with the fire of Brahmâ. From the body of the Risi, emitted, as it were, the rays of the thousand midday Suns. On his head was the golden matted hair. On his breast there was the hoary holy thread; he wore torn clothes; on his hands there was the Danda and Kamandalu; on his forehead there was the bright Tilaka in the form of the Crescent Moon. (Tilaka - a sectarian mark on the forehead made with coloured earth or sandalpaste.) One hundred thousand disciples, thoroughly-versed in the Vedas and the Vedângas, were attending him. The intoxicated Purandara, seeing him, bowed down to him and he began to chant with devotion hymns to his disciples also. They were very glad. The Risi with his disciples then blessed Indra and gave him one Pârijâta flower.When the Muni was returning from the region of Vaikuntha, Visnu, gave him that beautiful Pârijâta flower. Old age, death, disease, sorrows, etc., all are removed by the influence of the flower; and the final liberation is also attained. The Devendra was intoxicated with his wealth; so taking the flower given by the Risi, he threw it on the head of the elephant Airârata. No sooner the elephant touched the flower, than he became suddenly like Visnu, as it were, in beauty, form, qualities, fire and age. The elephant, then, forsook Indra andentered into a dense forest. The Lord of the Devas could, in no way, get him under his control. On the other hand, the Muni Durvâsâ seeing that Mahendra had thus dishonoured the flower, became inflamed with rage and cursed him saying, “O Indra! You are so mad with wealth that you have dishonoured me. The flower that I gave you so lovingly, you have thrown that, out of vanity, on the elephant’s head!
