Chapter	Text_no	Hymn
24	28-102	O Honoured One! For a long time you performed tapasyâ in this Bhârata, to get Me. S’ankhachûda, too, performed tapasyâ for a long time to get you. By that tapas, S’ankhachûda got you as wife. Now it is highly incumbent to award you also with the fruit that you asked for. Therefore I have done this. Now quit your this terestrial body and assume a Divine Body and marry Me. O Râme! Be like Laksmî. This body of yours will be known by the name of Gandakî, a very virtuous, pure and pellucid stream in this holy land of Bhârata. Your hairs will be turned into sacred trees and as they will be born of you, you will be known by the name of Tulasî. All the three worlds will perform their Pûjâs with the leaves and flowers of this Tulasî. Therefore, O Fair-faced One! This Tulasî will be reckoned as the chief amongst all flowers and leaves. In Heavens, earth, and the nether regions, and before Me, O Fair One, you will reign as the chief amongst trees and flowers. In the region of Goloka, on the banks of the river Virajâ, in the Râsa circle (the celestial ball dance,) where all amorous sentiments are played in Vrindârana forest, in Bhândîra forest, in Champaka forest, in the beautiful Chandana (Sandal Forests and in the groves of Mâdhavî, Ketakî, Kunda, Mallikâ, and Mâlatî, in the sacred places you will live and bestow the highest religious merits. All the Tîrthas will reside at the bottom of the Tulasî tree and so religious merits will accrue to all. O Fair-faced One! There I and all the Devas will wait in expectation of the falling of a Tulasî leaf. Anybody who will be initiated and installed with the Tulasî leaves water, will get all the fruits of being initiated in all the sacrifices. Whatever pleasure Hari gets when thousands and thousands of jars filled with water are offered to him, the same pleasure He will get when one Tulasî leaf will be offered to Him. Whatever fruits are acquired by giving Ayuta cows as presents, those will be also acquired by giving Tulasî leaves. Especiallyif one gives Tulasî leaves in the month of Kârtik, one gets the fruits same as above mentioned. If one drinks or gets the Tulasî leaf water at the momentous Time of Death, one becomes freed of all sins and is worshipped in the Visnu Loka. He who drinks daily the Tulasî leaf water certainly gets the fruit of one lakh horse sacrifices. He who plucks or culls the Tulasî leaf by his own hand and holding it on his body, quits his life in a Tîrath, goes to Visnu Loka. Whoever holds in his neck the garland made up of Tulasî wood, gets certainly the fruit of horse sacrifices at every step. He who does not keep his word, holding the Tulasî leaf in his hand, goes to the Kâlasûtra Hell as long as the Sun and Moon last. He who gives false evidence in the presence of the Tulasî leaf, goes to the Kumbhîpâka Hell for the life-periods of fourteen Indras. He who drinks or gets a bit of the Tulasî leaf water at the time of death, certainly goes to Vaikuntha, ascending on a car made up of jewels. Those who pluck or cull the Tulasî leaves in the Full Moon night, on the twelfth lunar day, on the passing of the sun from one sign to another, the mid-day, or on the twilights, on the night, while applying oil on their bodies, on the impurity periods, and while putting on night dresses, verily eat off the Nârâyana’s head. O Chaste One! The Tulasî leaf kept in the night, is considered sacred. It is considered good in S’râddha, vow ceremony, in the making over of any gift, in the installation of any image or in worshipping any Deva. Again, the Tulasî leaf fallen on the ground or fallen in water or offered to Visnu, if washed out can be used in holy and other purposes. Thus, O Good One! You will remain as tree in this earth and will remain in Goloka as the Presiding Deity thereof and will enjoy daily the sport with Krisna. And also you will be the Presiding Deity of the river Gandakî and thus bestow religious merits in Bhârata; you will be the wife of the Salt  Ocean, which is My part. You are very chaste; in Vaikuntha you will enjoy me as Râma lives with Me. And as for Me, I will be turned into stone by your curse; I will remain in India close to the bank of the river Gandakî. Millions and millions of insects with their sharp teeth will make rings, (the convolutions in the S’âlagrâma or sacred stones), on the cavities of the mountains there, representing Me. Of these stones, those that have one door (entrance hole), four convolutions, adorned by the garland of wild flowers (having a mark like this) and which look like fresh rain-cloud, are called Laksmî Nârâyana Mûrtis (forms). And those that have one door, four convolutions and look like fresh rain-clouds but no garlands are called Laksmî Jânardana Chakras (discus). Those that have two doors, four convolutions, and decked with mark like cow’s hoof and void of the garland mark are called Raghunâtha chakras. Those that are very small in size, with two Chakras and look like fresh rainclouds and void of the garland marks are named Vâmana Chakras. Those that that are very small in size, with two Chakras and the garland mark added, know then to be the S’rîdhara Chakras. These always bring in prosperity to the household. Those that are big, circular, void of garland mark, with two circular Chakras, are known as Dâmodara forms. Those that are mediocre in size, with two Chakras and marked as if struck by an arrow, having marks of arrows and bow-cases are known as Rana-Râmas. Those that are middling, with seven Chakras, having marks of an umbrella and ornaments, are called Râjarâjes’varas. They bestow the royal Laksmî to persons. Those that have twice seven chakras, and are big, looking like fresh rain-clouds are named Anantas. They bestow four fold fruits (Dharma, wealth, desire and liberation). Those that are in their forms like a ring, with two chakras, beautiful, looking like rain-clouds, having cow-hoof marks and of mediocre size are named Madhusûdanas. Those that have one Chakra are called Sudars’anas. Those that have their Chakras hidden are called Gadâdharas. Those that have two Chakras, looking horse-faced, are known as Hayagrîvas. O Chaste One! Those that have their mouths very wide and extended, with two Chakras, and very terrible, are known as Narasimhas. They excite Vairâgyas to all who serve them. Those that have two Chakras, mouths extended and with garland marks (elliptical marks) are called Laksmî Nrisinghas. They always bless the householders who worship them. Those that have two Chakras near their doors (faces), that look even and beautiful, and with marks manifested are known as Vâsudevas. They yield all sorts of fruits. Those that have their Chakras fine and their forms like fresh rain-clouds and have many fine hole marks within their wide gaping facets are called Pradyumnas. They yield happiness to every householder. Those that have their faces of two Chakras stuck together and their backs capacious, are known as Sankarsanas. They always bring in happiness to the householders. Those that look yellow, round and very beautiful are Anirudhas. The sages say, they give happiness to the householder. Where there is the S’âlagrâma stone there exists S’rî Hari Himself; and where there is Hari, Laksmî and all the Tîrthas dwell there. Worshipping S’âlagrâm S’ilâ, destroys the Brahmahatyâ (killing a Brâhmin) and any other sin whatsoever. In worshipping the S’âlagrâma stone looking like an umbrella, kingdoms are obtained; in worshipping circular S’ilâs,great prosperity is obtained; in worshipping cart-shaped stones, miseries arise; and in worshipping stones, whose ends look like spears (S’ûlas), death inevitably follows. Those whose facets are distorted, bring in poverty; and yellow stones bring in various evils and afflictions. Those whose Chakras look broken, bring in diseases; and those whose Chakrasare rent asunder bring in death certainly. Observing vows, making gifts, installing images, doing S’râddhas, worshipping the Devas, all these become highly exalted, if done before the S'âlagrâma S’ilâ. One acquires the merits of bathing in all the Tîrthas and in being initiated in all the sacrifices, if one worships the Sâlagrâma S’ilâ. What more than this, that the merits acquired by all the sacrifices, all the Tîrthas, all vows, all austerities and reading all the Vedas are all acquired by duly worshipping by the holy S’âlagrâma S’ilâ. He who performs his Abhis’eka ceremony always with S’âlagrâma water (being sprinkled with S’âlagrâma water at the initiation and Installation ceremonies), acquires the religious merits of performing all sorts of gifts and circumambulating the whole earth. All the Devas are, no doubt, pleased with him who thus worships daily the S’âlagrâma. What more than this, that all the Tîrthas want to have his touch. He becomes a Jîvanmukta (liberated while living) and becomes very holy; ultimately he goes to the region of S’rî Hari and remains in Hari’s service there and dwells with him for countless Prakritic dissolutions. Every sin, like Brahmâ Hatyâ, flies away from him as serpents do at the sight of Garuda. The Devî Vasundharâ (the Earth) becomes purified by the touch of the dust of his feat. At his birth, all his predecessors (a lakh in number), are saved. He who gets the S’âlagrâma S’ilâ water during the time of his death, he is freed of all his sins and goes to the Visnu Loka and gets Nirvâna; he becomes freed entirely from the effects of Karma and he gets, no doubt, dissolved and diluted for ever in (the feet of) Visnu. He who tells lies, holding S’âlagrâma in his hands, goes to the Kumbhîpâka Hell for the life-period of Brahmâ. If one does not keep his word, uttered with the S’âlagrâma stone in his hand, one goes to the Asipatra Hell for one lakh manvantaras. He who worships the S’âlagrâma stone without offering Tulasî leaves on it or separates the Tulasî leaves from the stone, will have to suffer separation from his wife in his next birth. So if one does not offer the Tulasî leaves in the conchshell, for seven births he remains without his wife and he becomes diseased. He who preserves the S’âlagrâma stone, the Tulasî and the conchshell, in one place, becomes very learned and becomes dear to Nârâyana. Look! He who casts his semen once in his wife, suffers intense pain, no doubt, at each other’s separation. So you become dear to S’ankhachûda for one Manvantara. Now, what wonder! That you will suffer pain, at his bereavement. O Nârada! Thus saying, S’rî Hari desisted. Tulasî quitted her mortal coil and assumed a divine form, began to remain in the breast of S’rî Hari like S’rî Laksmî Devî. Hari also went with her to Vaikuntha. Thus Laksmî, Sarasvatî, Gangâ, and Tulasî, all the four came sovery dear to Hari and are recognised as Îs’varîs. On the other hand, the mortal coil of Tulasî, no sooner quitted by Tulasî, became transformed into the river Gandakî. Bhagavân Hari, too, became also converted into a holy mountain, on the banks thereof, yielding religious merits to the people. The insects cut and fashion many pieces out of that mountain. Of them, those that fall into the river, yield fruits undoubtedly. And those pieces that fall on the ground become yellow coloured; they are not at all fit for worship. O Nârada! Thus I have spoken to you everything. What more do you want to hear now? Say.Here ends the Twenty-fourth Chapter of the Ninth Book on the glory of Tulasî in the Mahâpurânam S’rî Mad Devî Bhâgavatam of Eighteen Thousand verses by Maharsi Veda Vyâsa.
25	1-2	Nârada said :-- When the Devî Tulasî has been made so dear to Nârâyana and thus an object for worship, then describe Her worship and Stotra (the hymn of Tulasî) now. O Muni! By whom was She first worshipped? By whom were Her glories first sung? And how did She become therefore an object of worship? Speak out all these to me.
25	3	Sûta said :-- Hearing these words of Nârada, Nârâyana, laughing, began to describe this very holy and sin-destroying account of Tulasî.
25	4-15	Nârâyana said :-- Bhagavân Hari duly worshipped Tulasî, and began to enjoy her with Laksmî; He raised Tulasî to the rank of Laksmî and thus made her fortunate and glorious Laksmî and Gangâ allowed and bore this new union of Nârâyana and Tulasî. But Sarasvatî could not endure this high position of Tulasî owing to Her anger. She became self-conceited and beat Tulasî on some quarrel before Hari. Tulasî became abashed and insulted and vanished off. Being the Îs’varî of all the Siddhis, the Devî, the Self-manifest and the Giver of the Siddhiyoga to the Jñânins, Tulasî, Oh! what a wonder, became angry and turned out as invisible to S’rî Hari even.Not seeing Tulasî, Hari appeased Sarasvatî and getting Her permission went to the Tulasî forest. Going there and taking a bath in due accord, and with due rites, worshipped with His whole heart the chaste Tulasî and then began to meditate on Her with devotion. O Nârada! He gets certainly all siddhis who worships Tulasî duly with the ten lettered mantra :-- “S’rîm Hrîm Klîm Aim Vrindâvanyai Svâhâ,” the King of mantras, yielding fruits and all gratifications like the Kalpa Tree. O Nârada! At the time of worship, the lamp of ghee, waslighted and dhûp, sindûra, sandal, offerings of food, flowers, etc., were offered to Her. Thus hymned by Hari, Tulasî came out of the tree, pleased. And She gladly took refuge at His lotus feet. Visnu, then, granted her boon that, “You will be worshipped by all; I will keep you in My breast and in My head and the Devas also will hold you on their heads.” And He then took her to His own abode.
25	16	Nârada said :-- “O Highly Fortunate One! What is Tulasî’s dhyân, stotra and method of worship? Kindly describe all these.”
25	17	Nârâyana said :-- When Tulasî vanished, Hari became very much agitated at her bereavement and went to Vrindâvana and began to praise her.
25	18-44	The Bhagavân said :-- The Tulasî trees collect in multitudinous groups; hence the Pundits call it Vrindâ. I praise that dear Tulasî. Of old, She appeared in the Vrindâvana forest and therefore known as Vrindâvanî. I worship that fortunate and glorious One. She is worshipped always in innumerable universes and is, therefore, known as Vis’vapûjitâ (worshipped by all). I worship that Vis’vapûjitâ. By whose contact, those countless universes are always rendered pure and holy; and therefore She is called Vis’vapâvani (purifying the whole universe). I am suffering from her bereavement, I remember the Devî. Without Tulasî, the Devas do not get pleased, though other flowers be heaped on them; therefore She is considered as the essence of all the flowers. Now I am in sorrow and trouble and I am very eager to see her, who is of the nature of purity incarnate. The whole universe gets delighted when the Bhaktas receive her; hence She is called Nandinî; so may She be pleased with me. There is nothing in the universe that can be compared to Her; hence She is called Tulasî; I take refuge of that clear Tulasî. That chaste dear one is the life of Krisna, hence She is known as Krisnajîvanî. Now may She save my life. O Nârada! Thus praising, Ramâpatî remained there. The chaste Tulasî then came to His sight and bowed down to His lotus feet; when She becoming sensitive out of the insult, began to weep. Bhagavân Visnu, seeing that sensitive dear one, immediately took her to His breast. Taking, then, Sarasvatî’s permission, He took her to His own home and brought about, first of all, the agreement between her and Sarasvatî. Then He granted her the boon, “You will be worshipped by all, respected by all, and honoured by all; and all will carry you on their heads.” I will also worship, respect and honour you and keep you on My head. Receiving this boon from Visnu, the Devî Tulasî became very glad.Sarasvatî then attracted her to her side, made her sit close to her. Laksmî and Gangâ both with smiling faces attracted her and made her enter into the house. O Nârada! Whosoever worships her with her eight names Vrindâ, Vrindâvanî, Vis’vapûjitâ, Vis’vapâvanî, Tulasî, Puspasârâ, Nandanî and Krisna Jîvanî and their meanings and sings this hymn of eight verses duly, acquires the merit of performing As’vamedha Yajña (horse sacrifice). Specially, on the Full Moon night of the month of Kârtik, the auspicious birth ceremony of Tulasî is performed. Of old Visnu worshipped her at that time. Whoever worships with devotion on that Full Moon combination, the universe purifying Tulasî, becomes freed of all sins and goes up to the Visnu Loka. Offerings of Tulasî leaves to Visnu in the month of Kârtik bring merits equal to those in giving away Ayuta Cows. Hearing this stotra at that period gives sons to the sonless persons, wives to the wifeless persons and friends to friendless persons. On hearing this stotra, the diseased become free of their diseases, the persons in bondage become free, the terrified become fearless, and the sinners are freed of their sins. O Nârada! Thus it has been mentioned how to chant stotra to her. Now hear her dhyân and method of worship. In the Vedas, in the Kânva S’âkhâ branch, the method of worship is given. You know that one is to meditate on the Tulasî plant, without any invocation (âvâhana) and then worship her with devotion, presenting all sorts of offerings as required to her. Now hear Her Dhyânam. Of all the flowers, Tulasî (the holy basil) is the best, very holy, and captivating the mind. It is a flame burning away all the fuel of sins committed by man. In the Vedas it is stated that this plant is called Tulasî, because there can be made no comparison with Her amongst all the flowers. She is the holiest of them all. She is placed on the heads of all and desired by all and gives holiness to the universe. She gives Jîvanmukti, mukti and devotion to S’rî Hari. I worship Her. Thus meditating on Her and worshipping Her according to due rites, one is to bow down to Her. O Nârada! I have described to you the full history of S’rî Tulasî Devî. What more do yo want to hear now, say.Here ends the Twenty-fifth Chapter of the Ninth Book on the method of worship of Tulasî Devî in the Mahâpurânam S’rî Mad Devî Bhâgavatam of Eighteen Thousand verses by Maharsi Veda Vyâsa.
26	1-2	Nârada said :-- I have heard the anecdote of Tulasî. Now describe in detail the history of Sâvitrî. Sâvitrî is considered as the Mother of the Vedas. Why was She born, in days gone by? By whom was She first worshipped and subsequently also?
26	3-4	Nârâyana said :-- O Muni! She was first worshipped by Brahmâ. Next the Vedas worshipped her. Subsequently the learned men worshipped her. Next the King As’vapati worshipped Her in India. Next the four Varnas (castes) worshipped Her.
26	5	Nârada said :-- O Brâhman! Who is that As’vapati? What for did he worship? When the Devî Sâvitrî became adorable by all, by which persons was She first worshipped and by which persons subsequently?
26	6-14	Nârâyana said :-- O Muni! The King As’vapati reigned in Bhadrades’a, rendering his enemies powerless and making his friends painless. He had a queen very religious; her name was Mâlatî; She was like a second Laksmî. She was barren; and desirous of an issue, She under the instruction of Vas’istha, duly worshipped Sâvitrî with devotion. But She did not receive any vision nor any command; therefore She returned home with a grievous heart. Seeing her sorry, the king consoled her with good words and himself accompanied her to Puskara with a view to perform Tapas to Sâvitrî with devotion and, being self-controlled, practised tapasyâ for one hundred years. Still he could not see Sâvitrî, but voice came to him. An incorporeal, celestial voice reached his ears :-- “Perform Japam (repeat) ten lakhs of Gâyatrî Mantram.” At this moment Parâsara came up there. The king bowed down to him. The Muni said :-- O King! One japa of Gâyatrî, destroys the days sins. Ten Japams of Gâyatrî destroy day and night’s sins.
26	15-40	One hundred Gâyatrî Japams destroy one month’s sins. One thousand Japams destroy one year’s sins. One lakh Gâyatrî Japams destroy the sins of the present birth and ten lakh Gâyatrî Japams destroy the sins of other births. One hundred lakhs of Japams destroy the sins of all the births. If ten times that  be done, then liberation is obtained. (Now the method, how to make Japam). Make the palm of the (right) hand like a snake’s hood; see that the fingers are all close, no holes are seen; and make the ends of the fingers bend downwards; then being calm and quiet and with one’s face eastward, practise Japam. Then count from the middle of the ring (name-less) finger and go on counting right-handed (with the hands of the watch) till you come to the bottom of the index finger. This is the rule of counting by the hand. O King! The rosary is to be of the seed of white lotus or of the crystals; it should be consecrated and purified. Japam is to be done then in a sacred Tîrtha or in a temple. Becoming self-controlled one should place the rosary on a banyan leaf or on a lotus leaf and smear it with cowdung; wash it, uttering Gâyatrî Mantra and over it perform one hundred times Gâyatrî Japam intently in accordance withthe rules. Or wash it with Pañchagavya, milk, curds, clarified butter, cow urine and cowdung, and then consecrate it well. Then wash it with the Ganges water and perform best the consecrations. O Râjarsi! Then perform ten lakhs of Japam in due order. Thus the sins of your three births will be destroyed and then you will see the Devî Sâvitrî. O King! Do this Japam, being pure, everyday in the morning, mid-day, and in the evening. If one be impure and devoid of Sandhyâ, one has no right to do any action; and even if one performs an action, one does not get any fruit thereby. He who does not do the morning Sandhyâ and the evening Sandhyâ, is driven away from all the Brâhminic Karmas and he becomes like S’ûdras. He who does Sandhyâ three times throughout his life, becomes like the Sun by his lustre and brilliance of tapas. What more than this, the earth is always purified by the dust of his feet. The Dvîja who does his Sandhyâ Bandanam and remains pure, becomes energetic and liberated while living. By his contact all the Tîrthas become purified. All sins vanish away from him as snakes fly away at the sight of Garuda. The Dvîja who becomes void of Sandhyâ three times a day, the Devas do not accept his worship nor the Pitris accept his Pindas. He who has no Bhakti towards the Mûla Prakriti, who does not worship the specific seed Mantra of Mâyâ and who does not hold festivities in honour of Mûla Prakriti, know him verily to be an Ajagara snake without poison. Devoid of the Visnu mantra, devoid of the three Sandhyâs and devoid of the fasting on the Ekâdas’i Tithi (the eleventh clay of the fortnight), the Brâhmin becomes a snake devoid of poison. The vile Brâhmin who does not like to take the offerings dedicated to Hari and who does the washerman’s work and eats the food of S’ûdra and drives the buffaloes, becomes a snake devoid of poison. The Brâhmin who burns the dead bodies of the S’ûdras, becomes like the man who is the husband of an unmarried girl. The Brâhmin also who becomes a cook of a S’ûdra, becomes a snake void of poison. The Brâhmin who accepts the gifts of a S’ûdra, who performs the sacrifice of a S’ûdra, who lives as clerks and warriors becomes like a snake void of poison. The Brâhmin who sells his daughter, who sells the name of Hari or eats the food of a woman who is without husband and son, as well as of one who has just bathed after her menstruation period, becomes like a serpent void of poison. The Brâhmin who takes the profession of pimps and pampers and lives on the interest, is also like a serpent void of poison. The Brâhmin who sleeps even when the Sun has risen, eats fish, and does not worship the Devî is also like a poisonless serpent. Thus stating all the rules of worship in order, the best of the Munis told him the Dhyânam, etc., of the DevîSâvitrî, what he wanted. Then he informed the King of all the mantras and went to his own Âs’rama. The king, then worshipped accordingly and saw the Devî Sâvitrî and got boons.
26	41-43	Nârada said :-- What is the Sâvitrî’s Dhyân, what are the modes of her worship, what is stotra, mantra, that Parâs’ara gave to the King before he went away? And how did the King worship and what boon did he get? This great mystery, grand and well renowned in the S’rutis, about Sâvitrî, I am desirous to hear in brief on all the points.
