Chapter	Text_no	Hymn
17	3-26	Thus asked by the Devî, Mahisa began to say :-- “O Devî! There is a place, named Simhala, noted in this earth and decorated with various trees and prosperous with wealth and grains. A virtuous king, named Chandrasena, used to reign there; he was calm, peaceful, truthful, heroic, charitable, steady, forbearing, well versed in polities, ethics and morals vast as a wide ocean, learned in S’âstras, knowing all forms of religions and much skilled in archery. He was mindful in governing his subjects and he used to punish according to the laws of Justice. The king had a beautiful well-qualified wife, very handsome and broad-hipped. She was very much devoted to her husband and always engaged in religious acts and of good conduct. This wife, endowed with all auspicious signs, gave birth to a beautiful daughter in her first delivery. The King Chandrasena, the father, was very pleased to have this beautiful daughter and gladly called her by the name of Mandodarî. This daughter began to grow daily like the phases of the Moon. When she grew ten years old, she became very handsome. The King now became anxious to havea suitable bridegroom and used to think of it everyday. The Brâhmins then told the king that there was a prince named Kambugrîva, the intelligent son of the powerful king Sudhanvâ of Madra; this prince was endowed, with all kingly qualifications and versed in all knowledge and was therefore a fit match for your daughter. The king then asked his dear qualified wife that he would like to marry his daughter to Kambugrîva. The queen, hearing this, asked her daughter Mandodarî that her father was desiring to marry her to Kambugrîva, the son of the king of Madra. Hearing her mother’s words, Mandodarî spoke thus :-- “O Mother! I have got no desire to marry; I will not accept any husband; I will take the vow of leading a chaste virgin life and thus pass the rest of my life. O Mother! There is nothing more miserable in this ocean of world than dependence; I therefore prefer to lead incessantly a life of severe asceticism. The Pundits versed in the S’âstras say that taking up the vow of separateness and independence leads to salvation; I will thus be liberated; I have no need for a husband. At the time of marriage ceremony, one has to say before the consecrated Fire that one will remain always a dependent to one’s husband in every way; besides in a father-in-law’s house, one has to pass one’s time as a slave, as it were, to one’s mother-in-law and to husband’s (younger) brothers; again one will have to think oneself as happy when one’s husband is happy and as unhappy when one’s husband is unhappy; this is the worst of all miseries. Again if the husband marries again another woman, then this misery of having a co-wife is extreme. O Mother! Jealousy arises then towards even one’s own husband and therefore suffering is endless. Therefore what happiness can there be in this dream-like worlds; especially with women who are made dependent by Nature? O Mother! I heard that in days of yore the religious son of Uttânapâda, Uttama was younger than Dhruva; and yet he became King. And the King Uttânapâda banished his dear wife, solely devoted to her husband, without any cause, to the forest. Therefore women have to suffer such diverse pains while their husbands are living; and if by chance the husband dies, then women get interminable pains; the widowhood becomes the only source of grief and sorrow. Again if the husband be in foreign lands, women become subjected to the fire of Cupid, and then the house becomes an object of more agony. Thus whether the husband lives or dies, there is no happiness at any time. Thus, according to my opinion, I ought never to accept any husband.”
17	27-31	The Mother then told her husband all about what the daughter had said. Mandodarî would accept the vow of a life-long virgin; she had no desire to marry. She had brought forward many faults in a worldly life and thus would perform vows and Japams and pass her time alone.She did not yearn after a husband. The King, hearing thus, came to know, that his daughter had no intention to marry and so began to pass his time without giving away his daughter in marriage. Thus the daughter lived in family protected by her father and mother; by that time signs of puberty were seen in the body of the daughter. Her comrades requested her repeatedly to select a bridegroom; but she spoke many words of wisdom and did not show any inclination for marriage.
17	32-44	Once, on an occasion, that beautiful faced woman went out with her female attendants on a pleasure trip to a garden, beautified with various trees. There the slender bodied one began to play and enjoy with her comrades in picking up various flowers and beautiful flowering creepers. Just at that time, the famous King of Kosala, the powerful Vîrasena came there accidentally. Alone he was on his chariot, attended by a few soldiers; his large army and retinue were coming slowly behind him at some distance. Her comrades, then, looking at that King from a distance, told Mandodarî, “O friend! See! Somebody, strong and beautiful, like a second God of Love is coming towards us, mounted on a chariot. I think some King he will be and we are very lucky that he has come here.” While thus talking, the King arrived there. The King, looking on that blue coloured woman with beautiful eyes became surprised and getting down from the chariot, asked the maidservant, “O Gentle one! Who is this woman with large eyes! Who is her father? Tell me this without any delay.” The attendant smiling, told him thus :-- O Beautiful-eyed One! Pray speak first who are you? What for have you come here? What do you want to do here? The female attendant thus asking him, the King replied :-- There is a very beautiful country named Kosala, in this earth; I am the King of that place; my name is Vîrasena. My fourfold army is coming at my will at my back. I have lost my way and have come here. Know me as the King of the country Kosala.
17	45-49	The female attendant said :-- “O King! This lotus-eyed one is the daughter of the King Chandrasena; her name is Mandodarî. She has come here in this garden for sporting.” Hearing thus the attendant’s words, the King replied :-- “O Sairandhri! You appear to be smart; therefore make the King’s daughter understand my following words clearly! O Sweet-eyed one! I am the King descended from the Kakutstha line; O fair woman! Marry me according to the rules of Gandarbha marriage.”Note :-- Gandharva marriage: one of the eight forms of marriage; this form of marriage proceeds entirely from love or the mutual inclination of a youth and maiden without ceremonies and without consulting relatives.“O broad hipped One! I have no other wife; you are a beautiful woman, of a good family and of a marriageable age; I therefore like to marry you? Or your father may marry you to me according to rules and ceremonies; if so, I will no doubt be your husband as you desire.”
17	50-55	Mahisa said :-- O Devî! The female attendant, expert in the science of love, hearing the King’s words, spoke to the daughter smilingly and in sweet words. “O Mandodarî! A very good-looking beautiful King of the solar dynasty has come here; he is very pretty, powerful, and of your age; O Beautiful! The King is entirely devoted to you and loves you very much. O Large-eyed One! Your time of marriage has come and yet you have not married; rather you are against it. Your father is, therefore, always very sorry and remorseful. See! How many a time your father sighed and told us, ‘O attendants! Always serve my daughter and awaken her to this.’ But you are engaged in penances and austerities, in Hatha Dharma; therefore we cannot request you on this matter. The Munis have said :-- To serve the husband is the highest virtue of a woman. O Large-eyed! Women get Heaven if they serve their husband; therefore you better marry according to rules and ceremonies.”
17	56	Mandodarî said :-- I am not going to marry; better that I should perform an extraordinary tapasyâ (asceticism); O Girls! You go and ask the King desist in his request; why is he shamelessly looking at me.
17	57-59	The female attendant then said, “O Devî! Passion is very hard to conquer; time is also surmountable with difficulty; so know my advice as the medicinal diet and keep my request. And if you do not keep it, surely danger will befall you.” Hearing this, Mandodarî replied, “O attendant! I know whatever is ordained by Fate will inevitably come to pass; for the present, I am not going to marry at all.”
17	60-61	Mahisa said :-- The female attendant, knowing this her obstinate view, told the King :-- “O King! This woman likes not a good husband; you would better go wherever you like.” The King heard and did not want to marry that woman any more; and, being sad and broken-hearted, went back with his army to Kosala.Here ends the Seventeenth Chapter of the Fifth Skandha on Mandodarî’s accounts in the Mahâpurânam, S’rî Mad Devî Bhâgavatam, of Eighteen Thousand verses by Maharsi Veda Vyâsa.
18	1-4	Mahisa said :-- O Devî! Mandodarî had a sister Indumatî; unmarried and endowed with all auspicious signs. She grew up in time to a marriageable age. The Svayambara assembly (a marriage in which the girl chooses her husband from among a number of visitors assembled together) was then called for the marriage of the maiden Indumatî. The Kings from various parts came there and the maiden Indumatî selected from among them a beautiful strong king, of noble lineage and endowed with all auspicious signs. At that time, by the undescribeable power of Destiny, Mandodarî seeing the deceitful, cunning, and hypocrite King of Madra, became passionate and desired to marry him.
18	5-17	That slender woman Mandodarî then addressed her father thus :-- “O Father! Seeing the King of Madra in this assembly, I am desirous to marry him; so perform also my marriage ceremony now.” When the king heard this request from her own daughter privately, he became very glad and began with promptness, to make preparations for the marriage. He invited the King of Madra to his own palace and gave him in marriage his own daughter Mandodarî, according to due rites and ceremonies with an abundance of dowry and wealth. The King of Madra Chârudesna became very glad to marry the beautiful Mandodarî and went back with her to his own abode. The King Chârudesna then enjoyed her for good many days; when one day a maid-servant found the king in sexual intercourse with another maid-servant in a lonely place and divulged this to Mandodarî; she finding the king in that state became angry and rebuked him with a slight smiling countenance. Again, on another occasion, Mandodarî saw the king willingly engaged in amusements and sports with an ordinary beautiful woman and became very sorry and thought thus :-- When I saw him in the Svayamvara, I could not recognise him as a cheat; I am deceived by this King; Oh! What a wrong act have I done through delusion. This King is a rogue and he is totally shameless and has no dislike for contemptible things; it is now too late to repent for him. How can I have any affection for this husband; fie on my living now! I forsake from this very day all the pleasures with my husband and all other worldly pleasures, and I take recourse now to contentment alone. I have committed a very wrong act that I ought never to have done; therefore it causes intense pain to me now. If I now commit suicide, then that sin will never forsake me, and I must have to enjoy the consequences thereof. And if I return tomy father’s house, I will not be happy there, for my companions seeing me thus will, no doubt, ridicule me. Therefore, it is now advisable for me to avoid all the sensuous pleasures, become dispassionate and remain here patiently and abide by the strange combinations of Time.
18	18-20	Mahisa said :-- Thus that women lamented and remorsed and began to remain there, very much sorrowful and distressed, renouncing thoroughly all the pleasures of the world. O Auspicious One! I am the king, yet you are showing your dislike for me; know, eventually, you, too, will be passionate and entertain afterwards an illiterate coward. Keep my word even now, it will be of great benefit and it will serve as a medicinal diet to you as to all women. In case you do not follow my advice, you will have to meet with extreme pain and misery, certainly.
18	21-25	Hearing the words of Mahisâsura, the Devî said :-- O you fool! Go to the lower worlds or stand up for fight; I will send you and the other Dânavas unto death and then go away at my pleasure. O Demon! I take up form to preserve the righteous, whenever they suffer pain in this earth. O Lord of the Daityas! Formless, birthless I am; yet, at times, I take up form and be born to save the Devas. Know this firmly. O wicked Mahisa! The Devas prayed to Me for your destruction. Therefore I will not rest until I kill you. I speak all these truly to you. Therefore fight or go to Pâtâla, the abode of the Asuras; I speak truly to you again that I will destroy you wholly.
18	26-51	Vyâsa said :-- O King! Hearing thus the Devî’s words, the Dânava took up his bow and came to the battle, fully stretching the string of his bow up to his ears, and began to shoot sharpened arrows with great force at the Devî. The Devî, too, hurled with anger, arrows tipped with iron and cut off the Asura’s arrows to pieces. The fight between them rose to such a terrible pitch that it caused terror to both the Devas and the Dânavas, trying hard to be victorious over each other. In the midst of the terrible encounter, the demon Durdhara came up to fight and made the Devî angry and shot arrows, all terribly poisonous and sharpened on stones, at Her. The Bhagavatî, then, got very angry and hit him hard with sharp arrows. Durdhara, struck thus, fell down dead on the battlefield like a mountain top. The demon Trinetra, well skilled in the uses of arrows and weapons, seeing him killed, came up to fight and shot at the Great Goddess with seven arrows. Before these arrows came on Her, She cut them to pieces with Her sharp arrows and by Her trident killed Trinetra. Trinetra thus killed, Andhaka quickly came in the battlefield and struck violently on the head of the lion with his iron club. The lion killed that powerful Andhaka by striking the demonwith his nails and, out of anger, began to eat his flesh. Mahisâsura became greatly astonished at the death of these Asuras and began to shoot pointed arrows, sharpened on stone, at Her. The Devî Ambikâ cut his arrows into two before they came on Her and struck the Demon on his breast by Her club. That vile Mahisâsura, the tormentor of the Devas, fell in a swoon under the stoke of the club but patiently bore it and, at the next moment, came again and struck the lion on his head by his club. The lion, too, by his nails rent that great Asura to pieces. Mahisâsura, then, quitting the man-form took up the lion-form and by his claws cut the Devî’s lion and wounded him very much by his nails. On Mahisâsura taking up this lion-form, the Devî became very angry and began to shoot arrows after arrows at him all very terrible, sharp and like poisonous snakes. Then the Asura quitting the lion form assumed the appearance of a male elephant, oozing out juice from his temples and began to hurl the mountain tops by his trunk. Seeing the mountain peaks thus hurled on Her, She cut them off to pieces by Her sharp arrows and began to laugh. The Devî’s lion on the other hand, sprang on the head of the elephant Mahisa and by his claws rent him to pieces. To kill the Devî’s lion, then, Mahisa quitted his elephant-form and assumed the appearance of a Sarabha, more powerful and terrible than lion. The Devî seeing that Sarabha became angry and struck on the head of that Sarabha with Her axe; the Sarabha, too, attacked the Devî. Their fight became horrible; Mahisâsura, then, assumed the appearance of a buffalo and struck the Bhagavatî by his horns. That horrible Asura, of hideous appearance, swinging his tail, began to attack the thin bodied Devî. That violent Asura caught hold of the mountain peaks by his tail and, whirling them round and round, hurled them on the Devî. That vicious soul, then, maddened with his strength, laughed incessantly and addressed thus :-- “O Devî! Be steady in the battlefield. I will send you today unto death, and your youth and beauty too. You are an illiterate fellow as you have come maddened to fight with me. Really you are deluded in your pretensions that you are very strong; this idea of yours is absolutely false. I will kill you first and the hypocrite Devas after who want to vanquish me by standing up a woman in their front.”
18	52-53	The Devî said :-- “O Villain! Do not boast; keep yourself firm in the fight. Today I will kill you and make the Devas discard their fear. O Wretch! You are a Sinner; you torment the Devas and terrify the Munis. Let me have my drink of sweet decoction of grapes. And then I will slay you undoubtedly.”
18	54-70	Vyâsa said :-- O King! Saying thus, the Devî, wrathful and eager to kill Mahisâsura, took up the golden cup filled with wine and drank again and again. When the Devî finished Her drink of the sweet grape juice, She pursued him with trident in Her hands, to the great joy of gladdening all the Devas. The Devas began to rain showers of flowers on the Devî and praised Her and shouted victories to Her with Dundubhi (a Divine drum) Jai, Jîva; victory, live. The Risis, Siddhas, Gandarbhas, Pis’âchas, Uragas, and Kinnaras witnessed the battle from the celestial space and became very much delighted. On the other hand, Mahisâsura, the hypocrite Pundit, began to assume various magic forms and struck the Devî repeatedly. The Devî Chandikâ, then, infuriated and with eyes reddened, pierced violently the breast of that vicious Mahisa with Her sharp trident. The Demon, then, struck by this trident, fell senseless on the ground; but got up in the next moment and kicked the Devî forcibly. That Great Asura, thus kicking the Devî, laughed repeatedly and bellowed so loudly that the Devas were all terrified with that noise. Then the Devî held aloft the brilliant discus of good axle and of thousand spokes and loudly spoke to the Asura in front :-- O Stupid! Look! This Chakra will sever your throat today; wait a moment, I am sending you instantly unto death. Saying this, the Divine Mother hurled the Chakra. Instantly that weapon severed the Dânava’s head from his body. The hot streams of blood gushed out from his neck as the violent streams of water get out from mountains, coloured red with red sandstones. The headless body of that Asura moved, to and fro, for a moment and then dropped on the ground. The loud acclamations of “Victory” were sounded to the great joy of the Devas. The very powerful lion began to devour the soldiers that were flying away, as if he was very hungry. O King! The wicked Mahisâsura thus slain, the Demons that remained alive were terrified and fled away, very much frightened, to Pâtâla. The Devas, Risis, human beings and the other saints on this earth were all extremely glad at the death of this wicked Demon. The Bhagavatî Chandikâ quitted the battlefield and waited in a holy place. Then the Devas came there with a desire to praise and chant hymns to the Devî, the Bestower of their happiness.Here ends the Eighteenth Chapter of the Fifth Book on the killing of the Dânava Mahisâsura in S’rî Mad Devî Bhâgavatam, the Mahâ Purânam of Eighteen Thousand verses by Maharsi Veda Vyâsa.
19	1	Vyâsa said :-- O King! Then Indra and all the Devas became very glad to see the great Mahisâsura slain; they all began to praise and chant hymns to the World-Mother.
